video_id,title,description,published_at,channel_title,view_count,like_count,comment_count,duration,topic,professional
DmsPKACOnU4,Hormone Balance Frequency: Hormone Balance Meditation Music,Unlock the power of Hormone Balance Frequency! Experience the unique benefits of balancing hormone frequency and hormone ...,2020-09-03T03:47:35Z,Good Vibes - Binaural Beats,882769,18000,1358,PT9H15M16S,hormone_balance,FALSE
TluPdhRXFjw,Can intermittent fasting affect hormone balance?,"Intermittent fasting can affect various hormones in the body. Some of these effects can be beneficial, but others may have potential ...",2023-06-21T09:05:18Z,Fastic,482,NA,0,PT59S,hormone_balance,FALSE
z8Su_tR0ifE,5 Signs of Hormonal Imbalance,,2024-01-09T15:47:48Z,Juicing Tutorials,262111,2719,24,PT13S,hormone_balance,FALSE
Zq2QaIs0PC0,DO THIS FOR MORE HAPPY HORMONE Dopamine #health #healing #motivation #yoga #hormonebalance #tips,BOOST DOPAMINE NATURALLY ! . Dopamine is a neurotransmitter and hormone that is released as a reward by the brain ...,2023-10-24T12:30:18Z,Mayur Karthik,197528,NA,59,PT25S,hormone_balance,FALSE
9K8SZpdMkOQ,25-Minute Yoga for PCOS and PCOD | Exercise to Balance Hormones | Saurabh Bothra Yoga,Join Free Yoga Challenge - https://habuild.yoga/free Check out my last video on: 20-Minute Yoga Workout for Women at Home ...,2025-08-13T16:00:21Z,Saurabh Bothra,143757,4126,190,PT24M18S,hormone_balance,FALSE
nULLGLPQGcE,Best PCOS Diet for Hormone Balance | PCOS Mein Kya Khana Chahiye? | Asaan Diet Plan,"Struggling with PCOS and don't know what to eat? In this video, we'll guide you through the best PCOS diet plan that helps ...",2025-10-23T14:01:14Z,Marham Find A Doctor,617,24,2,PT3M50S,hormone_balance,FALSE
hGj0RSsJTGs,3 Miracle Seeds for Fast Weight Loss | Balance Hormones Naturally | Dr Hansaji,"In this video, Hansaji reveals how three tiny seeds — flaxseeds, hemp seeds, and kalonji — can naturally support weight loss and ...",2025-09-16T13:30:47Z,The Yoga Institute,149887,3304,137,PT4M30S,hormone_balance,FALSE
_sXNKiWFzCY,HORMONE BALANCING DRINK |METHI | AJWAIN | JEERA | SAUF | GINGER #pcod #pcos #hormonebalance #drink,,2024-11-30T12:30:59Z,Vidushi Choudhary,523624,7371,133,PT19S,hormone_balance,FALSE
0ykIa18M9sM,"Balance Your Hormones | PCOS, Infertility, Fibroids,Endometriosis | Boost healing | PART - 10","Yoga for hormone balance becomes more than just exercise, it becomes a path to self-healing. From regulating periods to ...",2025-09-11T04:23:34Z,Akshaya Agnes,87596,3096,197,PT27M14S,hormone_balance,FALSE
5JvbjrLESPs,"Yoga For PCOS, Hormonal Imbalances &amp; Irregular Periods | Part -1 || Effective Asanas for Cure","Follow my NEW YouTube channel for pregnancy, postpartum & fertility - BIRTH WITH AGNES ...",2021-03-13T13:26:58Z,Akshaya Agnes,3834047,76082,3526,PT23M26S,hormone_balance,FALSE
L0-ZjRoA1fE,Top 10 foods for egg quality #renourishwithlav #hormonethozhi #hormonebalance #fertilitysupport,Improving egg quality starts with nutrient-rich foods* Berries provide antioxidants that protect eggs from oxidative stress.,2025-08-18T12:10:00Z,Hormone Thozhi,35443,657,4,PT35S,hormone_balance,FALSE
plQgXjdeHho,This Simple Breakfast Swap Can Fix Your Hormones #hormonehealth,"If you're used to starting your mornings with cereal or toast, you might be unintentionally setting your hormones up for struggle.",2025-12-06T16:01:21Z,Fertility Mom,2773,73,4,PT30S,hormone_balance,FALSE
8JXf1VwSzi0,Hormone Balance &amp; Metabolism Reset for Women Over 30,"Hormone Balance & Metabolism Reset for Women Over 30 ​ ​ This week on Energy Shift with Erin, Certified Master Health ...",2025-11-19T07:18:05Z,MOMnation,17,1,0,PT31M2S,hormone_balance,FALSE
-X3TIsDuEEg,Hormonal Balance &amp; Stress Relief : Try These Mudras! 🌱🖐️,Here's an amazing Pranayama for you    ‍♀️ Add this to your daily yoga routine and notice the changes yourself✨️ Join my ...,2024-12-03T11:19:45Z,Yogini Srishti,74455,2876,41,PT46S,hormone_balance,FALSE
kdgFe4xFAi8,Simple Asanas for healthy uterus/healthy periods/pcod/PCOS/Hormonal balance/conceive naturally ✅🧘‍♀️,,2025-05-03T06:19:00Z,yogmantra8_,8279384,NA,32,PT6S,hormone_balance,FALSE
YTrf66wJBec,##simple yoga poses for PCOD/PCOS/Hormonal imbalance##🧘‍♀️🧘‍♀️🧘‍♀️,,2024-09-20T06:27:25Z,yogmantra8_,1845533,NA,43,PT11S,hormone_balance,FALSE
7OD_Ddih3sQ,Low Libido? Root Causes &amp; Natural Solutions for Hormone Balance,"Low libido may signal underlying hormone or stress issues. Dr. Aaron Kleinpeter explains how cortisol, thyroid health, and other ...",2025-11-20T18:00:17Z,Enovative Wellness Center,1,0,0,PT26S,hormone_balance,FALSE
Gl99czTLiVA,Top 10 Foods to Balance Estrogen Levels and Support Hormonal Health! #health #wellness,Top 10 Foods to Balance Estrogen Levels and Support Hormonal Health! #health #wellness Struggling with hormonal imbalances ...,2025-04-18T18:38:44Z,VitalizingHealthTips,184952,2848,12,PT15S,hormone_balance,FALSE
g5naT6XCico,HORMONAL BALANCE | Solfeggio Frequency 528Hz + 432Hz,Specifically created for Hormonal Balance in Women More Tips on How to Balance Your Hormones: 1. Don't take your phone first ...,2025-05-22T13:08:35Z,vl.vladimirovaa,119786,2811,61,PT3H33M34S,hormone_balance,FALSE
W4EF9XsJHqs,The Gut Health + Hormone Balance Diet No One Talks About (Fermented Foods Included!),The Gut Health and Hormone Balance Diet isn't just a trend—it's a science-backed strategy to help your body thrive. In this ...,2025-07-10T14:00:47Z,Dr. Jolene Brighten,1727,81,10,PT46M5S,hormone_balance,FALSE
N6CTP_FehCI,"7 Estrogen-Friendly Foods Women Must Eat for Hormone Balance, Collagen Boost &amp; Glowing Skin","If you're in your 40s or 50s and noticing changes in your skin, mood, energy, or hormones — you are not alone. Welcome to Life In ...",2025-11-25T15:11:22Z,Life in Harmony,1590,55,0,PT17M20S,hormone_balance,FALSE
pGL-tdr1Kbw,Hormonal Imbalance Women l female hormones ko balance kaise kare by Dr Aisha Ghias,This video explores the hormonal changes that females experience throughout their lives and how they can lead to hormonal ...,2023-04-02T17:00:31Z,Dr Aisha Ghias,230170,4358,108,PT58S,hormone_balance,FALSE
9gcOIz3M5ww,Exploring Hormone Balance and Wellness with Cher Olivos,"Exploring Hormone Balance and Wellness with Cher Olivos In this episode of Composed Living, host Elsa Elbert interviews Cher ...",2025-11-11T20:23:18Z,Composed Living,7,NA,0,PT41M47S,hormone_balance,FALSE
XiVcgg3__uQ,The BEST hormone balance vitamins for women! ☀️#health #wellness,,2023-09-05T00:55:29Z,Mona Wazir,113637,1589,22,PT11S,hormone_balance,FALSE
EVEaQ-JZjLk,"Top Hormone-Balancing Foods | Naturally Boost Estrogen, Testosterone, Cortisol &amp; Melatonin #shorts","Meal preparation container https://amzn.to/4oR8lps Feeling tired, moody, or out of balance? Your hormones might be the ...",2025-10-14T16:30:06Z,Glow Dynasty ,353246,885,68,PT6S,hormone_balance,FALSE
1ckpzur6rKM,Adaptogen Herbs: for Hormone Balance &amp; Stress,10 Adaptogen Herbs for Hormone Balance. [Subtitles] In today's video we explore the best 10 adaptogen herbs in the world for ...,2020-06-19T11:00:00Z,Ryan Taylor (Natural Remedies),10366,607,24,PT6M22S,hormone_balance,FALSE
hQHDKTtA1UQ,How Gratitude Lowers Stress &amp; Supports Better Hormone Balance,"Want a simple way to support your hormones every single day? In this Hot Hormone Tip, Robin Nielsen shares how one daily ...",2025-12-01T04:51:09Z,Natural Hormone Solution,20,2,0,PT8M40S,hormone_balance,FALSE
4SiL0hm3APw,The cure for hormonal imbalance - Ayurveda Tips &amp; Advice,The cure for the hormonal imbalance - Ayurveda Tips & Advice #health #bonehealing #bonehealth #ayurveda #ayurvedic ...,2023-02-08T17:44:01Z,Dr.Amit Verma,486520,8170,20,PT32S,hormone_balance,FALSE
vRGIMW_GbLU,🌿 Flaxseeds for Hormone Balance | Why You NEED This Superfood!,Flaxseeds = A Hormone-Balancing Superfood! Did you know that flaxseeds contain 75-800x more lignans than any other plant ...,2025-04-13T12:01:31Z,Nidhi Kakar,7772,186,5,PT1M4S,hormone_balance,FALSE
WcJsY9ZJTXE,Seed Cycling for Hormone Balance | Hormone Health 3 Tips | Dr Umme Raheel&#39;s Remedies! | Madeha Naqvi,seedcycling #dryfruits #beautytips #eyes #brain #skinwhitening #drbilquis #drbatool #drummeraheel #greenchilli #blackpaper ...,2025-09-24T11:31:16Z,SAMAA TV,16317,302,8,PT14M45S,hormone_balance,FALSE
WUmMMwjY_Cc,Yoga for Hormone Balance (Naturally Balance Hormones) #yogae #weightlosstips #yoga #moonpose #shorts,Balance Hormones) #yogae #weightlosstips #yoga #moonpose #shorts#challenge #weightlossexercise #motivation #fatloss ...,2025-06-29T23:45:04Z,XTREME FITNESS ,30234,512,5,PT6S,hormone_balance,FALSE
rgUOHCUJre0,TOP 5🖐️ AYURVEDIC HERBS to Balance FEMALE HORMONES #femalefitness #ayurvedic #hormonalimbalance,TOP 5🖐️ AYURVEDIC HERBS to Balance FEMALE HORMONES #femalefitness #ayurvedic #hormonalimbalance TOP 5🖐️ ...,2025-05-21T12:11:27Z,Strength and Sanskar,10216,NA,16,PT19S,hormone_balance,FALSE
2JYAhGUHkn4,Yoga for Hormone Balance 🌞🧘‍♀️,,2023-10-14T01:47:47Z,Medhya Herbals,21263,610,3,PT37S,hormone_balance,FALSE
jpNv27WBcsM,Yoga for pcod &amp; imbalance hormones✅ #yoga #fitness #shorts #explore #fyp #shortvideo #ytshorts,,2025-07-19T03:29:35Z,Neelam kandwal,2355450,41019,67,PT52S,hormone_balance,FALSE
S0FtrsOQt-Q,WHAT I EAT IN A DAY FOR HORMONE BALANCE / 100G PROTEIN / *DAIRY-FREE*,"For my fellow chronic illness friends, here's a What I Eat in a Day video sharing my gluten-free and dairy-free recipes and meals.",2024-05-11T23:47:26Z,"Clean Eating Kitchen - with Carrie Forrest, MPH",1408,60,11,PT13M34S,hormone_balance,FALSE
uHgJsb4RPoQ,Seed Cycling for Hormone Balance | Hormone Health 3 Tips | Dr Umme Raheel&#39;s Remedies! | Madeha Naqvi,seedcycling #dryfruits #beautytips #eyes #brain #skinwhitening #drbilquis #drbatool #drummeraheel #greenchilli #blackpaper ...,2025-09-24T13:09:46Z,Subh Ka Samaa Madeha Kay Sath ,5412,132,3,PT14M45S,hormone_balance,FALSE
GAvc9uLYfJY,Reiki to Balance Hormones | Energy Healing for Hormonal Imbalance,Reiki to Balance Hormones | Energy Healing for Hormonal Imbalance - Reiki Session from a Reiki Master. MORE ...,2017-05-01T20:47:11Z,Divine White Light,344948,4679,278,PT6M47S,hormone_balance,FALSE
0kV8-MnKrZI,"हॉर्मोन इम्बैलेंस में कौनसे फ़ूड खाने चाहिए 🌸 | Ovulation, Hormonal Balance &amp; Pregnancy","Hormonal imbalance se periods irregular, ovulation delay aur pregnancy me dikkat hoti hai. Beautiful women ❤️, agar aap bhi ...",2025-10-27T06:27:26Z,Prerna's Fertility Care,63035,1287,14,PT1M,hormone_balance,FALSE
XJ-OT8z_Jj4,Natural Herbal Tea Blend for PCOS Balance Hormones &amp; Heal Naturally #pcos,Every herb in this tea is intentionally selected to help address the unique challenges women with PCOS face. Let's break it down: ...,2025-01-26T20:34:23Z,Roshelle Zielinski,2554,134,12,PT1M58S,hormone_balance,FALSE
9YEnw-Fsj24,Best Seeds for Thyroid Health | Boost Hormone Balance Naturally!#healthtips  #dailyhealthtips,Best Seeds for Thyroid Health | Boost Hormone Balance Naturally! Looking for natural ways to support your thyroid? In this video ...,2025-08-02T12:30:12Z,Dr.Roshan's Homoeo care,32520,206,3,PT20S,hormone_balance,FALSE
YZgOAGymXxk,Gentle Stretch | Period Health and Hormone Balance Tips — Low-Impact Mobility,Need a recovery day with real talk? This 24-minute gentle stretching session is paired with an honest conversation about ...,2025-11-11T16:01:01Z,HIITBURN,621,17,1,PT24M47S,hormone_balance,FALSE
ERIS4Au3fRA,Top 5 Herbal Teas for Hormone Balance &amp; Stress Relief,"Top 5 Herbal Teas for Hormone Balance & Stress Relief In this video, we reveal the Top 5 Herbal Teas that naturally support ...",2025-07-12T19:54:24Z,MEDI LAB ZONE,852,27,0,PT2M35S,hormone_balance,FALSE
H-lM1hKlapI,PCOD Complete Breakdown: Symptoms + Causes + Best Diet Plan for Hormone Balance,"PCOD (Polycystic Ovarian Disorder) is one of the most common hormonal conditions affecting females today — and sadly, most ...",2025-11-17T04:30:12Z,Dr Ambika Dutt,2885,179,16,PT8M23S,hormone_balance,FALSE
6L1cJ9UuUdY,"15 Best Hormone-Balancing Foods | Naturally Boost Estrogen, Testosterone&amp; More! #shorts #healthyfood",Protein powder https://amzn.to/4mBlhOh Did you know that the foods you eat can balance your hormones naturally? ✨ From ...,2025-10-01T15:44:00Z,Glow Dynasty ,257538,1034,8,PT6S,hormone_balance,FALSE
EVEMwcB3PyY,Meditation for Hormone Balance,"Before beginning your practice, please consult a medical professional to see if meditation is right for you. This meditation should ...",2019-04-25T22:43:56Z,Annie Rosenberg,44002,1283,60,PT11M17S,hormone_balance,FALSE
TpcxII-gSiE,Best Foods For Hormonal Imbalance | Top 5 Hormone Balancing Foods #shorts #hormoneimbalance #health,"hormonal imbalance in women treatment, home remedy for hormonal imbalance, hormonal imbalance and pregnancy, best foods ...",2022-11-21T14:14:50Z,Supermom Recipes & Vlogs,483569,7671,19,PT15S,hormone_balance,FALSE
BdiA6OJ0zSA,Supplements for Hormone Balance 🌞 #shorts,,2023-08-20T08:20:56Z,Medhya Herbals,19600,286,2,PT38S,hormone_balance,FALSE
dTtK-yNWCcM,Don&#39;t Miss The Secret To Hormone Balance: Here&#39;s How Herbs Could Help!,"In this video, we're going to learn about the secret to hormone balance and how herbs could help! Managing hormones is ...",2022-06-10T14:45:10Z,"KhadiYah Preciado, Yah's Apothecary",11928,389,52,PT7M3S,hormone_balance,FALSE
616v1MR_678,Seed Cycling for hormone balancing! #homemade #hormonebalance #hormonehealth  #seedcycling,SEED- CYCLING FOR HORMONES!! Firstly I'm sick of people (especially older aunties!) saying 'you're too young to be in ...,2025-06-11T07:00:06Z,Chef Chinu Vaze,8832,196,8,PT41S,hormone_balance,FALSE
jsQuxUl3YSo,Hormonal Balance Diet Plan | Indian Diet Plan for Women |  Tips For Hormonal Balance,"Indian Diet Plan for Women | Diet For Hormonal Balance and Weight Loss | Meal Plan, Tips & Drinks | Hindi | Best Foods for ...",2024-11-04T13:01:01Z,Bharat Infertility Clinic,3839,80,0,PT35S,hormone_balance,FALSE
LF3-Vy7EeqY,How to Eat for Hormone Balance in Perimenopause,"If you're busy, overwhelmed, or constantly “starting over,” this video shows you how to eat in a way that supports your hormones ...",2025-11-13T03:23:57Z,"Dariella Gonitzke, MS, RD, FMN",16,2,0,PT6M17S,hormone_balance,FALSE
GrRzScvxi7k,Calming Yoga Stretch for Stress &amp; Hormone Balance #yoga #flexibility,"Take a deep breath and unwind with this Calming Yoga Stretch. Perfect for stress relief, better sleep, or a peaceful reset during ...",2025-05-19T15:51:35Z,Adison Briana,12043,532,35,PT9M25S,hormone_balance,FALSE
0d4TPJdCl8E,5 Powerful Foods for Hormone Balance | Dr. Shawana Mufti | Munazzah Arif | Madeha Naqvi | SAMAA TV,hormonalbalance #ivf #ivftreatment #ivfjourney #pregnancy #stressrelief #depression #menopause #periods #drnidanajmi ...,2025-08-08T12:39:21Z,Subh Ka Samaa Madeha Kay Sath ,44772,659,24,PT15M59S,hormone_balance,FALSE
cznoDwm_PYs,how i eat for hormone balance &amp; fertility 🌱 realistic high-protein meals (plus grocery haul!),"hanging out, grocery shopping & making healthy cells — enjoy today's vlog | Feeling the high cost of low magnesium? Pique's ...",2025-06-30T20:49:43Z,Cambria Joy,16240,565,58,PT22M32S,hormone_balance,FALSE
TIRY5t0JR8w,Hormonal Imbalance कैसे करें Control 🌸 || Natural Treatment for Hormone Balance || Dr. Jyoti Gupta,Video Topic : Hormonal Imbalance कैसे करें Control || Natural Treatment for Hormone Balance || Dr. Jyoti Gupta ...,2025-11-12T14:00:58Z,DrJyotiAyurvedaIndore,1701,76,37,PT9M57S,hormone_balance,FALSE
8IpzOCmy0MQ,9 Secrets to Hormone Balance with Robin Nielsen,FULL Blogpost: https://marcsklar.com/9-secrets-to-hormone-balance/ ‎ ✨EMPOWER YOUR HORMONES ...,2018-10-15T14:22:25Z,Dr. Marc Sklar - FertilityTV,3103,59,5,PT39M59S,hormone_balance,FALSE
Ny7tp9fCFm0,इन 8 लक्षणों से जाने क्या आपके हार्मोन गड़बड़ है ? Sign &amp; Symptoms of Hormonal imbalance #shorts,youtubesaheli #Hormonalimbalance #progesteronehormone #misscarriage #fertilitydiet #ayurvedictipsforfertility #infertility ...,2023-03-24T05:12:28Z,Prerna's Fertility Care,1017929,28355,171,PT1M,hormone_balance,FALSE
TMolKbl6IeI,"💚 PCOD, PCOS  Hormone Balance Issue, Solution By Famous Coach 💪 Nitesh Soni #shorts #niteshsoni",,2024-10-19T02:30:25Z,Fehmida In The Kitchen,16923,531,6,PT41S,hormone_balance,FALSE
VPpfAo_pQVs,5 Powerful Foods for Hormone Balance | Dr. Shawana Mufti | Munazzah Arif | Madeha Naqvi | SAMAA TV,hormonalbalance #ivf #ivftreatment #ivfjourney #pregnancy #stressrelief #depression #menopause #periods #drnidanajmi ...,2025-08-08T12:22:21Z,SAMAA TV,149778,983,39,PT15M59S,hormone_balance,FALSE
pK6-v68NZCA,Hormone Balance Drink suggested by Fitness Coach Nitesh Soni #shorts #shortvideo #ytshorts,,2025-04-07T06:39:56Z,Shivani ki Kitchen,59752,1446,6,PT24S,hormone_balance,FALSE
XrF8huXKu4g,HORMONAL IMBALANCE Remedy | Drink this water 30 Days,HORMONAL IMBALANCE Remedy | Drink this water 30 Days What is an Ovarian Cyst? Ovarian cysts are fluid-filled sacs on or ...,2024-09-27T13:47:52Z,RenaiSSance Diets,80780,NA,19,PT9S,hormone_balance,FALSE
GuPAP2u38OU,Is Estrogen the Holy Grail for Hormone Balance | Expert Advice from Carol Petersen,"Is estrogen the secret to achieving optimal hormone balance? In this expert-led video, Carol Petersen explains the crucial role of ...",2025-01-06T18:10:31Z,Chemaines Model Health,743,34,10,PT57M54S,hormone_balance,FALSE
YtykS4ZN-Jg,Hand Massage to Balance Hormones &amp; Cure Insomnia Naturally | Yoga Shakti,Discover the power of ancient acupressure in this simple yet powerful hand massage therapy that helps balance hormones and ...,2025-05-19T12:01:06Z,YOGA SHAKTI - Shakti Pachauri ,62452,1857,21,PT41S,hormone_balance,FALSE
yJwWA31HKp4,Healthy Periods &amp; Seed Cycling | Hormone Balance Naturally,"Do you struggle with irregular periods, PCOS/PCOD, PMS, or painful cycles? This video explains how seed cycling — a natural, ...",2025-07-21T12:24:06Z,DtSiva,32920,750,15,PT57S,hormone_balance,FALSE
xe_yEjFQD5k,Yu total hormone balance #perimenopause  #hormones #hormonebalance #pms,,2025-04-28T01:38:37Z,Ashley Marie Beauty ,261,2,0,PT25S,hormone_balance,FALSE
wg4n73f3Jf0,"106: Detoxification, Hormone Balance, and True Wellness with Dr. Jessica Peatross","In this eye-opening episode of Keeping Abreast, Dr. Jenn Simmons welcomes Dr. Jessica Peatross for a deeply personal ...",2025-08-11T12:01:51Z,Dr. Jenn Simmons,899,53,7,PT1H21M23S,hormone_balance,FALSE
B11JMwAAndo,"The Master Antioxidant for Bone Health, Hormone Balance &amp; Longevity | Dr. Nayan Patel","Are you struggling with aging, hormone imbalances, or bone loss? In this powerful episode, Debi Robinson interviews Dr. Nayan ...",2025-06-12T07:00:19Z,Debi Robinson Wellness,255,12,4,PT1H1M49S,hormone_balance,FALSE
097QPYWxfug,✨PCOS &amp; Hormonal Balance ke liye 8 powerful yoga poses #PCOSYoga #FertilityYoga #WomenHealth#,,2025-09-09T02:06:06Z,yogmantra8_,486194,NA,2,PT10S,hormone_balance,FALSE
_TgnWnBRg7I,"The Protein Fix: How To Eat For Energy, Muscle, + Hormone Balance | Solo Q+A","344: In this solo episode, I'm answering your most pressing wellness questions, from navigating iron deficiency and late-night ...",2025-07-23T10:00:59Z,Be Well by Kelly,678,14,1,PT1H10M20S,hormone_balance,FALSE
cljqQJE_hco,Herbs &amp; Nutrition for Hormone Balance | PREVIEW | Herbal Health Course with Rachelle Robinett,"Sex, stress, sleep and more - learn essential hormones, how they work, common imbalances, and herbal + holistic treatments for ...",2020-05-21T20:27:53Z,Rachelle Robinett,1241,33,2,PT37S,hormone_balance,FALSE
6TcAV5lIaJg,1335 Hz Solfeggio Frequency: Hormonal Balance &amp; Adrenal Healing Frequency,Struggling with *hormonal imbalances?* Discover the power of the *1335 Hz Solfeggio Frequency* to bring about *Hormonal ...,2021-08-19T10:39:08Z,Good Vibes - Binaural Beats,247053,5263,343,PT11H55M,hormone_balance,FALSE
700ZVJBKZF8,Herbal Natural Remedies for Hormone Balance 💚,shorts #hormonebalance #weightloss #womenhealth #menstrualhealth.,2023-08-18T11:00:03Z,Medhya Herbals,8646,114,0,PT39S,hormone_balance,FALSE
LKKcI2SJS_Y,How to Boost Your Fertility: Hormone Balance,"A hormonal imbalance can affect your chances of getting pregnant. However, taking matters into your own hands by tracking your ...",2021-11-11T01:24:53Z,Mira,1993,35,0,PT24M57S,hormone_balance,FALSE
1yI7Xqv4Xhg,Hormonal Imbalance? Try this Acupressure point message for 2 minutes everyday,acupressure hormonal imbalance acupressure points to balance female hormones hormone balance acupuncture points ...,2024-08-25T12:29:00Z,Life Plus Yoga Center,3687,78,1,PT21S,hormone_balance,FALSE
QaPWKb5faMg,Foods hormonal imbalance  #trending #easydietinglifestyle #healthyfood #dietplan #hormonebalance,"White Bread – Causes Insulin Resistance, Disrupting Cortisol. Tea/Coffee – Stimulates Cortisol Production, Leading to Adrenal ...",2024-12-01T05:23:01Z,Dietician Kajal Aggarwal,32761,817,2,PT49S,hormone_balance,FALSE
-4UnH6Uc-30,Meditation for Hormone Balance and Fertility,"The stress we experience on a daily basis can come from many sources. This can be internally from environmental stressors, ...",2022-04-18T18:05:22Z,Annie Rosenberg,4132,120,9,PT29M54S,hormone_balance,FALSE
F-ZXGWTz0z4,"Natural Remedy For Hormonal Imbalance, Hair Fall and Weight Loss #shorts #shortvideo #health",Supermomrecipesandvlogs #hormonalimbalance #hairfall #weightloss #fenugreek #methidana fenugreek water or mergi dana ...,2022-12-18T03:56:12Z,Supermom Recipes & Vlogs,610909,10902,124,PT34S,hormone_balance,FALSE
YmLeJP2CjFY,The Basics Woman Hormone Balance Brew Review ☕️✨,"hormonebalance #tea #review Tried the Basics Woman Hormone Balancing Brew, and it's been a game-changer! Packed with ...",2025-06-18T12:54:55Z,Shruti Sharma,2516,31,0,PT52S,hormone_balance,FALSE
EmRdKBIPZNg,❋ Female Hormone Balance ~ Full Reproductive System Healing ~ Gentle Rain Sounds,DISCLAIMER: This video is not intended to replace medical treatment. The information provided is for educational purposes only ...,2022-09-12T13:15:22Z,Lucy Herzig ~ Subliminal Veritas,313861,4451,449,PT8M16S,hormone_balance,FALSE
UeOMlUBlYl4,Hormone Imbalance - Achieve Hormone Balance Naturally with Thin Balance Shake or Pills,www.WomensHealthyHormones.com.,2014-03-30T16:21:08Z,Women's Healthy Hormones,488,4,0,PT48S,hormone_balance,FALSE
sdK02JEA02w,"#263 Stress, Adrenal Health, and Hormone Balance in Women with Christa Biegler","Welcome back to the Nutrition and Life Podcast! In this empowering episode, Lisa Franz sits down with registered dietitian Christa ...",2025-11-28T10:01:39Z,Nutrition Coaching and Life,30,1,2,PT40M57S,hormone_balance,FALSE
eUa3cqHfHm4,‼️BEST ANTI-AGING HACK AND WARNING ‼️ #skincare #sunburn #antiaging #sunprotection #doctorreacts,,2025-04-28T17:25:07Z,"Dr. Ethan Melillo, PharmD",4276591,115430,2002,PT43S,anti_aging,FALSE
lndzjNnImMQ,The truth about anti-aging #dermatologist,antiagingskincare #antiaging #skincareadvice #skincaretips.,2022-11-15T00:00:23Z,Dr Dray,581397,25461,543,PT27S,anti_aging,FALSE
xlUFNI8YryM,Grading Anti-Aging Therapies from A to F!,,2025-04-07T20:08:57Z,Doctor Youn,67470,2470,36,PT1M7S,anti_aging,FALSE
XedzGGbDes8,Affordable Anti-Aging Skincare Routine for 40+ year olds!,SHORTSMAS #youtubeshorts #shorts30 #dermatologist #skincare #drsugaiskincare #evidencebasedmedicine #skincareroutine ...,2024-11-21T22:02:25Z,Dr. Daniel Sugai,281523,10051,136,PT1M,anti_aging,FALSE
SdJUv6O22to,The Best Anti-Aging Skincare Routine,SHORTSMAS #youtubeshorts #shorts30 #dermatologist #skincare #drsugaiskincare #evidencebasedmedicine ...,2024-09-11T16:00:34Z,Dr. Daniel Sugai,129982,2169,19,PT9S,anti_aging,FALSE
gP82HEqMam8,Adapalene for anti-aging #dermatologist @DrDrayzday,adapalene #antiaging #antiagingskincare #retinoids #retinol.,2023-04-07T23:35:31Z,Dr Dray,98770,2786,72,PT30S,anti_aging,FALSE
gP82HEqMam8,Adapalene for anti-aging #dermatologist @DrDrayzday,adapalene #antiaging #antiagingskincare #retinoids #retinol.,2023-04-07T23:35:31Z,Dr Dray,98770,2786,72,PT30S,anti_aging,FALSE
Ts939qId75E,Dermatologist&#39;s #1 anti-aging tip: sunscreen &amp; sun protection! #antiaging,See more of my anti-aging skincare tips here: https://youtu.be/I0HBgoHvvmg CONNECT WITH ME: Instagram: ...,2023-08-25T13:00:32Z,Dr. Sam Ellis,70064,3612,71,PT43S,anti_aging,FALSE
Ts939qId75E,Dermatologist&#39;s #1 anti-aging tip: sunscreen &amp; sun protection! #antiaging,See more of my anti-aging skincare tips here: https://youtu.be/I0HBgoHvvmg CONNECT WITH ME: Instagram: ...,2023-08-25T13:00:32Z,Dr. Sam Ellis,70064,3612,71,PT43S,anti_aging,FALSE
95UetDh8scg,Dermatologist anti aging morning routine,,2022-08-11T00:56:31Z,Dr. Mark,3028789,92872,1567,PT29S,anti_aging,FALSE
iZbXvHfHkYc,Accutane or Tretinoin? The Anti-Aging Battle #dermatologist,,2025-04-16T23:00:47Z,Dr Dray,37803,1251,93,PT1M49S,anti_aging,FALSE
iZbXvHfHkYc,Accutane or Tretinoin? The Anti-Aging Battle #dermatologist,,2025-04-16T23:00:47Z,Dr Dray,37797,1251,93,PT1M49S,anti_aging,FALSE
iM8muO9drhM,Budget Anti-Aging Part 1 #shorts,,2023-08-07T14:00:35Z,Dr. Shereene Idriss,2427576,110967,976,PT45S,anti_aging,FALSE
iM8muO9drhM,Budget Anti-Aging Part 1 #shorts,,2023-08-07T14:00:35Z,Dr. Shereene Idriss,2427576,110967,976,PT45S,anti_aging,FALSE
fzZv5idhpxc,Top anti-aging &amp; longevity foods,mitochondria #naturalhealth #health #antiaging #longevity SUBSCRIBE FOR MORE: ...,2025-04-22T18:22:24Z,Dr. Josh Axe,12351,765,13,PT1M18S,anti_aging,FALSE
ObchFIOjDqY,This Is Extreme! Bryan Johnson&#39;s Anti-Aging Skincare Routine,Bryan Johnson's Anti-Aging Skincare Routine. Dermatologist Dr. Dray reacts to Bryan Johnson's skincare routine ...,2024-01-11T17:00:16Z,Dr Dray,459235,10167,1280,PT30M23S,anti_aging,FALSE
