video_id,title,description,published_at,channel_title,view_count,like_count,comment_count,duration,topic,professional
qJq5hA4pnOk,Understanding Cardiovascular Disease: Visual Explanation for Students,"We cover cardiovascular disease in this episode. As part of that we talk about atherosclerosis, risk factors, end results of ...",2019-01-10T03:29:26Z,Zero To Finals,569106,8393,225,PT8M59S,cardiovascular_diseases,TRUE
lTCF8y7e1Bw,Cardiovascular Disease Overview,"Gain a comprehensive overview of cardiovascular disease, including its major types, risk factors, and impact on the heart and ...",2015-06-23T04:24:02Z,Armando Hasudungan,727746,10646,313,PT13M32S,cardiovascular_diseases,TRUE
EATkbpqlxvc,What is coronary artery disease? | Circulatory System and Disease | NCLEX-RN | Khan Academy,Created by Vishal Punwani. Watch the next lesson: ...,2014-10-22T20:40:51Z,khanacademymedicine,858739,6786,194,PT13M39S,cardiovascular_diseases,TRUE
qaogc-nPxGw,Coronary heart disease - One minute explainer with Dr John Morgan,Coronary heart disease is the leading cause of death in Australia. Five per cent of Australians are living with coronary heart ...,2024-04-05T01:45:26Z,The Royal Melbourne Hospital,1730,21,NA,PT1M,cardiovascular_diseases,TRUE
5wSfCZESRHU,GCSE Biology Revision &quot;Cardiovascular Diseases&quot;,"For thousands of questions and detailed answers, check out our GCSE workbooks ...",2017-09-12T19:25:51Z,Freesciencelessons,540924,5958,172,PT4M26S,cardiovascular_diseases,TRUE
vHpRrsDSheE,"Coronary Artery Disease (CAD) Anatomy, Nursing, Heart Disease, Pathophysiology, Treatment Part 1","Coronary artery disease (also called coronary heart disease) NCLEX lecture video on the nursing, anatomy, pathophysiology, ...",2016-09-05T19:10:44Z,RegisteredNurseRN,1706592,13044,243,PT19M57S,cardiovascular_diseases,TRUE
1xGTcQtNqdI,Cardiovascular Disease,UF/IFAS Dietitian Dr. Anne Mathews talks about cardiovascular disease and shares ways to keep your heart healthy.,2015-04-01T19:27:52Z,UF IFAS Extension,805,NA,NA,PT1M23S,cardiovascular_diseases,TRUE
ZhGzU0Chv1g,Reversing heart disease: Mayo Clinic Radio,"On the Mayo Clinic Radio program, Dr. Stephen Kopecky, a Mayo Clinic cardiologist, discusses how heart disease can be ...",2020-02-16T06:00:03Z,Mayo Clinic,370976,6127,NA,PT10M36S,cardiovascular_diseases,TRUE
u7k6sqTxOCU,Heart Disease | Health | Biology | FuseSchool,Heart Disease | Health | Biology | FuseSchool Let's start with coronary heart disease or CHD in short. It's when fatty deposits build ...,2019-07-16T08:00:03Z,FuseSchool - Global Education,116169,886,51,PT4M33S,cardiovascular_diseases,TRUE
Oqt9TgWcrxI,Mayo Clinic Minute: What is heart disease?,Heart disease is used interchangeably with the term cardiovascular disease and refers to a variety of conditions relating to the ...,2018-10-31T14:29:32Z,Mayo Clinic,266295,792,NA,PT1M1S,cardiovascular_diseases,TRUE
XsuJfPgHwrM,"What is Cardiovascular Disease? | The Kidney Disease, Heart Disease, and Diabetes Connection | NKF",Was this video helpful? Tell us: https://kidneyforms.tfaforms.net/4727666 Donate to support our mission today: ...,2022-05-12T23:50:12Z,National Kidney Foundation,91195,118,3,PT2M33S,cardiovascular_diseases,TRUE
Wnnok8gIFdc,The Worst Heart Disease #heart #hearthealth,,2024-03-06T15:00:23Z,Institute of Human Anatomy,400582,28711,223,PT58S,cardiovascular_diseases,TRUE
oilWYSvhTu0,"Valvular Heart Disease, Infective Endocarditis &amp; Rheumatic Carditis - Medical-Surgical | @LevelUpRN","Pathophysiology, risk factors, signs and symptoms, diagnosis, and treatment of valvular heart disease, infective endocarditis, and ...",2021-10-06T22:00:17Z,Level Up RN,195461,2748,74,PT8M5S,cardiovascular_diseases,TRUE
6dofUUCwhvI,What are the telltale signs of heart disease?,TV Personality Bob Harper discusses some of the signs and symptoms he endured from surviving a heart attack himself.,2021-02-25T03:02:00Z,ABC News,237154,1834,356,PT5M15S,cardiovascular_diseases,TRUE
WHs2rWH95mE,Diabetes and Heart Disease,Visit our website to learn more about using Nucleus content for patient engagement and content marketing: ...,2019-02-04T17:00:03Z,Nucleus Medical Media,523310,5244,289,PT3M48S,cardiovascular_diseases,TRUE
IOSNDtppnco,Atherosclerosis and Hypertension - Medical-Surgical - Cardiovascular System | @LevelUpRN,"The pathophysiology, risk factors, signs and symptoms, labs, diagnosis, treatment, nursing care, and patient teaching associated ...",2021-10-08T16:00:18Z,Level Up RN,174391,2960,37,PT7M30S,cardiovascular_diseases,TRUE
A6M7Qx5tqEE,The biggest risk for heart disease,The Workbook: https://on.bozmd.com/BozWorkbook https://on.bozmd.com/WalmartBozWorkbook --------------------- Thanks for ...,2024-09-29T17:00:05Z,"Dr. Boz [Annette Bosworth, MD]",2916542,111858,2169,PT1M,cardiovascular_diseases,TRUE
y6QJceOAVY0,"Coronary heart disease, clogged arteries and atherosclerosis","This animation will show you how risk factors like high cholesterol, high blood pressure and smoking can lead to blocked arteries ...",2015-12-03T17:08:24Z,British Heart Foundation,394291,NA,2,PT1M21S,cardiovascular_diseases,TRUE
-G7gu1O3c20,Understanding Cardiovascular Diseases,"Cardiologist, Dr. Michelle Pipo gives us a thorough discussion about cardiovascular diseases which is one of the leading causes ...",2015-03-12T02:42:21Z,UNTV News and Rescue,2007,20,3,PT14M54S,cardiovascular_diseases,TRUE
2BcaALrQ3PU,Ischemic Heart Disease (Coronary Artery Disease),"In this lecture, Dr Mike explains ischemic heart disease (coronary artery disease) and how it can lead to acute coronary ...",2024-06-12T13:00:02Z,Dr Matt & Dr Mike,104396,2958,126,PT36M4S,cardiovascular_diseases,TRUE
c8HjmEERv1k,Can You Reverse Coronary Artery Disease?,"For more information on coronary artery disease, please visit https://cle.clinic/3BAULgv More than 360000 people died from ...",2021-11-25T05:00:10Z,Cleveland Clinic,603732,4008,20,PT4M11S,cardiovascular_diseases,TRUE
R6jntzglV2M,Heart Failure - Medical-Surgical (Med-Surg) - Cardiovascular System - @LevelUpRN,"The pathophysiology of heart failure, the signs and symptoms of left-sided and right-sided heart failure, labs, diagnosis, treatment, ...",2021-10-06T21:30:05Z,Level Up RN,248843,6067,185,PT6M58S,cardiovascular_diseases,TRUE
T7jubmS22S0,TYPES OF HEART DISEASE,"February is Heart Disease Awareness Month. Let's start by talking about the different types of heart disease. In this video, I briefly ...",2023-02-07T15:00:17Z,The Intense MD,11687,135,6,PT8M56S,cardiovascular_diseases,TRUE
plhf1QUTam4,An Introduction To Cardiovascular Disorders (Lecture),"http://www.interactive-biology.com - In this video, I start talking about what happens when things go wrong with the cardiovascular ...",2014-05-26T19:13:35Z,Interactive Biology,66235,747,47,PT26M6S,cardiovascular_diseases,TRUE
t8FF6OESqVQ,Take Diabetes to Heart: Linking Diabetes and Cardiovascular Disease,Having diabetes means you are more likely to develop heart disease and have a greater chance of a heart attack or a stroke.,2019-10-28T15:19:55Z,National Institute of Diabetes and Digestive and Kidney Diseases (NIDDK),106626,312,25,PT2M17S,cardiovascular_diseases,TRUE
yTT9NhepmEY,Easy trick for Cyanotic Heart Diseases 🫀👶 #medschool #medstudent #usmle #usmlestep1 #usmlestep2,,2025-05-21T12:14:05Z,medschoolbro,59936,2247,13,PT46S,cardiovascular_diseases,TRUE
WzSLKk4d50g,Heart Failure Medications &amp; Antihypertensives | RN &amp; PN NCLEX - Simplified Pharmacology for Nursing,Today's video is all about congestive heart failure (CHF) medications and antihypertensive drugs for Nursing Students and ...,2019-02-17T15:30:00Z,SimpleNursing,770003,15946,169,PT4M5S,cardiovascular_diseases,TRUE
9IfEAdusc_E,How to decrease your risk for Cardiovascular Disease #doctor #heartattack #hearthealth,,2025-01-16T14:52:06Z,"Jeremy London, MD",74256,8309,144,PT52S,cardiovascular_diseases,TRUE
flJsXOMhuK0,What is Coronary Artery Disease - Mechanism of Disease,"Watch the video to get an overview of coronary artery disease development and pathogenesis, more at ...",2018-09-11T14:05:46Z,Thrombosis Adviser,1169202,5188,NA,PT2M38S,cardiovascular_diseases,TRUE
frUxLyipCJY,"Common Symptoms of Cardiovascular Disease - Dr. Kris Dosh, UP Health System - Marquette",Dr. Kris Dosh of the UP Health System - Marquette Heart & Vascular team discusses common signs and symptoms of ...,2017-03-10T16:05:07Z,UP Health System,13858,80,9,PT3M25S,cardiovascular_diseases,TRUE
OPfbUagp3qE,Cardiovascular Disease and Menopause,Dr. Erin Michos discusses how the menopause transition influences cardiometabolic risk factors and the relationship between ...,2023-09-06T18:44:22Z,MenopauseSociety,4007,37,4,PT13M1S,cardiovascular_diseases,TRUE
ArBZ4E-iDbE,Cardiovascular disease (CVD): What is it?,Cardiovascular disease (CVD) describes a group of conditions that affect your heart or blood vessels. Cardiovascular events like ...,2022-06-29T23:42:18Z,MyHealth.Alberta.ca,19033,88,NA,PT1M59S,cardiovascular_diseases,TRUE
DCm7Th_Mka0,Living with Cardiovascular Disease: Nancy’s Story,"Despite leading a healthy lifestyle, Nancy's life changed forever in 2015 when she experienced a sudden heart attack. Since then ...",2024-03-21T16:08:36Z,Amgen,10812,NA,NA,PT1M24S,cardiovascular_diseases,TRUE
uuXJNJ9LvdM,Short Heart Failure Video,"FULL Congestive Heart Failure on our YouTube Channel here: https://youtu.be/r5W1ns5C1ik Understanding the pathophysiology, ...",2019-09-01T23:30:11Z,SimpleNursing,1978281,24849,720,PT2M27S,cardiovascular_diseases,TRUE
eucApNV-t8Q,Cholesterol And Heart Disease 👉,Cholesterol And Heart Disease.,2024-11-06T22:25:17Z,KenDBerryMD,99232,8537,170,PT29S,cardiovascular_diseases,TRUE
5hiLY5oFprY,"334 - Cardiovascular disease, the number one killer: development, biomarkers, apoB, and more","Tom Dayspring is a world-renowned expert in clinical lipidology & a previous guest on The Drive. In this episode, Tom explores ...",2025-02-03T05:10:00Z,Peter Attia MD,91475,1921,307,PT2H24M2S,cardiovascular_diseases,TRUE
YmDMMf2jG5c,Kawasaki Disease - Pediatric Nursing - Cardiovascular Disorders | @LevelUpRN,"Cathy covers Kawasaki Disease. The pathophysiology, phases of Kawasaki disease, symptoms associated with each phase, ...",2022-01-02T05:35:45Z,Level Up RN,194905,3117,114,PT7M27S,cardiovascular_diseases,TRUE
UbFXqjABIvo,🔴The Truth about Cholesterol and Heart Disease - Dr Anthony Chaffee MD,"In my recent debate on Cholesterol with ACNEM, I made the case that we have completely gotten it wrong about cholesterol ...",2022-02-16T16:35:46Z,Anthony Chaffee MD,405103,19219,1902,PT32M52S,cardiovascular_diseases,TRUE
n_dlVV7-4WE,How to Manage Risk Factors to Prevent and Treat Cardiovascular Disease,"In this virtual event, Dr. Stephen Trachtenberg, a cardiology specialist and medical director of the Cardiac Rehabilitation Center at ...",2021-01-21T11:32:16Z,Palm Beach Gardens Medical Center,284,NA,NA,PT26M3S,cardiovascular_diseases,TRUE
8dxjyzhGjwM,Cardiovascular disease should not be the leading cause of death,"This clip is from episode #311 ‒ Longevity 101: a foundational guide to Peter's frameworks for longevity, and understanding CVD, ...",2024-08-01T19:00:08Z,Peter Attia MD,251648,7979,223,PT34S,cardiovascular_diseases,TRUE
h3P8wzNp6Gw,Cardiovascular Diseases: Signs and Symptoms,"Cardiologist, Dr. Michelle Pipo gives us a thorough discussion about cardiovascular diseases which is one of the leading causes ...",2015-03-12T02:43:55Z,UNTV News and Rescue,32404,320,18,PT17M35S,cardiovascular_diseases,TRUE
2dF4M6S3vgA,THIS WILL REVERSE HEART DISEASE!  #eattobeatdisease #foodasmedicine #drwilliamli,"My new book ""Eat to Beat Your Diet"" is out now! Get your copy here: https://drwilliamli.com/etb-diet-book/ Follow Dr. Li on Social ...",2025-04-24T14:00:04Z,Dr. William Li,338123,13856,255,PT48S,cardiovascular_diseases,TRUE
67tUtS3y_GA,Coronary Artery Disease | Clinical Medicine,"Premium Member Resources: https://www.ninjanerd.org/lecture/coronary-artery-disease Ninja Nerds! In this lecture, Professor ...",2024-03-11T23:00:06Z,Ninja Nerd,445725,9503,230,PT52M22S,cardiovascular_diseases,TRUE
51JPMeb8rQo,Living with Cardiovascular Disease: Latrice&#39;s Story,Latrice Baxter shares how her journey living with cardiovascular disease has led her to become an advocate for the ...,2023-11-02T23:41:03Z,Amgen,1896,NA,NA,PT3M13S,cardiovascular_diseases,TRUE
_uPqp0X5wxk,Save this trick to never forget valves &amp; murmurs again!🫀#medschool #medstudent #cardiology #usmle,,2024-05-01T12:30:01Z,medschoolbro,216189,8609,62,PT34S,cardiovascular_diseases,TRUE
OWZ0b1RcINY,What is cardiovascular disease? | Bupa Health,"Discover more about what Cardiovascular Disease is with Bupa Cardiology Clinical Adviser, Dr Yassir Javaid and Bupa Health.",2017-02-16T10:00:12Z,Bupa Health,3418,20,NA,PT43S,cardiovascular_diseases,TRUE
l8eJToqTsi8,The Relationship Between Sleep Apnea and Cardiovascular Disease,"Mayo Clinic cardiologist and sleep expert Virend Somers, M.D., Ph.D., discusses sleep apnea and its impact on the ...",2017-07-24T14:08:27Z,Mayo Clinic,83259,932,NA,PT12M55S,cardiovascular_diseases,TRUE
YJ9Rw4Qysyk,Congenital Heart Defects - Pediatric Nursing - Cardiovascular Disorders | @LevelUpRN,"Cathy covers congenital heart defects (CHDs) that result in increased pulmonary blood flow, including: Atrial Septal Defect (ASD), ...",2021-12-31T15:00:36Z,Level Up RN,178031,2910,56,PT8M2S,cardiovascular_diseases,TRUE
TLIq4YPHpxU,Atherosclerotic Cardiovascular Disease (ASCVD),"Atherosclerotic Cardiovascular Disease or ASCVD, is characterized by the accumulation of plaque within arteries, which can lead ...",2023-09-25T19:10:04Z,SIMED Health,4273,29,0,PT2M54S,cardiovascular_diseases,TRUE
KiI9WMXBV_o,Valvular Heart Diseases | Clinical Medicine,Premium Member Resources: https://www.ninjanerd.org/lecture/valvular-heart-disease Ninja Nerds! Professor Zach Murphy ...,2024-03-11T23:00:20Z,Ninja Nerd,380676,9747,176,PT46M42S,cardiovascular_diseases,TRUE
h413NHcx7eo,What is cardiovascular disease? | Victor Chang Cardiac Research Institute,Watch the video to learn: - How prevalent is cardiovascular disease? - What types of cardiovascular diseases are there? - What ...,2021-05-12T07:01:31Z,Victor Chang Cardiac Research Institute,131758,1279,20,PT2M35S,cardiovascular_diseases,TRUE
6bwBcAR2f5g,"Pericarditis, Cardiac Tamponade &amp; Cardiomyopathy - Medical-Surgical - Cardiovascular | @LevelUpRN","The pathophysiology, signs and symptoms, diagnosis, treatment and nursing care associated with pericarditis, cardiac tamponade ...",2021-10-06T22:30:01Z,Level Up RN,178618,2475,46,PT8M12S,cardiovascular_diseases,TRUE
0KoZQfU30Mg,Eat This…Opens Arteries to Heart &amp; Brain!  Dr. Mandell,,2022-11-13T19:24:15Z,motivationaldoc,4036090,235710,3699,PT57S,cardiovascular_diseases,TRUE
xenKhlwOfbE,Heart Failure and Hypoxemia - Pediatric Nursing - Cardiovascular Disorders | @LevelUpRN,"Cathy covers heart failure, including the pathophysiology, signs/symptoms, labs, diagnosis, treatment, and nursing care of patients ...",2021-12-31T17:00:52Z,Level Up RN,66445,943,23,PT8M57S,cardiovascular_diseases,TRUE
JagMlG8xgek,How to think about preventing cardiovascular disease,"This clip is from episode #311 ‒ Longevity 101: a foundational guide to Peter's frameworks for longevity, and understanding CVD, ...",2024-08-08T19:00:15Z,Peter Attia MD,94223,5081,136,PT55S,cardiovascular_diseases,TRUE
tQWLsU5ph94,Congenital Heart Defects - Pediatric Nursing - Cardiovascular Disorders | @LevelUpRN,"Cathy covers congenital heart defects that cause obstruction of blood flow, including: coarctation of aorta (COA), aortic stenosis ...",2021-12-31T16:00:36Z,Level Up RN,124461,1847,43,PT10M27S,cardiovascular_diseases,TRUE
02SL-xxeiNw,4 Ways to Prevent Heart Disease,"Preventing heart disease is simple according to National Jewish Health Cardiologist Andrew Freeman, MD. Get his top four ways ...",2017-04-07T16:49:10Z,National Jewish Health,190822,4103,143,PT2M42S,cardiovascular_diseases,TRUE
WSrXJ888YO0,Signs of Heart Disease in Babies and Young Children,CongenitalHeartDisease #HeartHealth #BabyHealth #ChildHealth #SignsOfHeartDisease #HeartAwareness #Pediatrics ...,2024-12-26T17:05:00Z,Modern Heart and Vascular Institute,21544,121,1,PT20S,cardiovascular_diseases,TRUE
l8V1551A_6k,Does HRT prevent cardiovascular disease?,Ever wonder why many doctors believe hormone therapy reduces the risk of heart disease? It goes back to the Women's Health ...,2025-05-15T11:01:18Z,"Heather Hirsch MD, MS, NCMP",5100,228,6,PT1M28S,cardiovascular_diseases,TRUE
0nkZUCcsD0Y,Supplements and Cardiovascular Disease: Helpful? Harmful?,"To learn more from the preventative cardiology team, please visit https://cle.clinic/2VYKStr For more information about Preventive ...",2021-08-18T16:25:17Z,Cleveland Clinic,9245,111,10,PT7M23S,cardiovascular_diseases,TRUE
XprmCVflDTY,GCSE Biology - Cardiovascular Disease &amp; Treatments (2026/27 exams),Check out our website https://www.cognito.org/ ⭐️ *** WHAT'S COVERED *** 1. Introduction to Cardiovascular Disease (CVD) ...,2025-03-24T14:38:22Z,Cognito,39437,573,35,PT5M39S,cardiovascular_diseases,TRUE
FqtPzkJoMeo,Prof. Peter Schnatz - Hormonal Therapy &amp; Cardiovascular Disease – why all the confusion?,The International Menopause Society is proud to provide the interview series for health care professionals on current topics of ...,2023-03-14T14:36:58Z,International Menopause Society,1631,30,3,PT14M2S,cardiovascular_diseases,TRUE
V-AtWOPKxoo,Diet and Cardiovascular Disease,Do you want a healthy heart? Learn more about Diet and Cardiovascular Disease and learn what to do to keep your heart healthy.,2021-02-26T08:40:06Z,Loma Linda University Health,20247,238,16,PT37M44S,cardiovascular_diseases,TRUE
lQDcGFrbfLI,Atherosclerotic Cardiovascular Disease: What It Is and How It&#39;s Treated | GoodRx,"In this video, Cardiologist Jennifer Haythe, MD, discusses atherosclerotic cardiovascular disease (ASCVD) and how the treatment ...",2025-02-14T21:00:42Z,GoodRx,318,5,0,PT3M12S,cardiovascular_diseases,TRUE
bHKEiZHAPRY,The Connection Between Cardiovascular Disease &amp; ED,Men with erectile dysfunction are about 40% more likely to suffer from a heart attack or stroke than men without ED. Dr. James ...,2019-08-28T02:29:30Z,Utah Men's Health,564,3,1,PT42S,cardiovascular_diseases,TRUE
pNn7pICPAvU,The Easy Way to Understand Congenital Heart Disease 🫀 | Cardiology,Struggling with ECGs? Download our FREE 2-page InfoDoc to easily decode waveforms and intervals ...,2018-02-20T09:00:06Z,Lecturio Medical,488357,7661,205,PT34M44S,cardiovascular_diseases,TRUE
y7hiVD53aBU,Study: Food can reverse heart disease,A new study provides more evidence that a vegan diet can reverse heart disease. CNN's Dr. Sanjay Gupta reports.,2014-07-14T16:03:32Z,CNN,227180,2804,422,PT1M29S,cardiovascular_diseases,TRUE
g8SYFG4vn-w,"Central Valley cardiologist explains the effects of alcohol on heart, cardiovascular disease",A Central Valley cardiologist with Kaiser Permanente explains the affects of alcohol on heart and cardio vascular disease.,2025-05-01T00:36:00Z,CBS News Sacramento,483,8,2,PT1M32S,cardiovascular_diseases,TRUE
fJzLUQ-1Yrs,Alcohol as a risk factor for cardiovascular disease,"In this video you will learn about the link between alcohol use and heart disease, and what happens to your heart when you drink ...",2025-04-08T17:21:42Z,St. Joseph's Health Care London,538,1,NA,PT6M17S,cardiovascular_diseases,TRUE
Wyxz0fgp6-A,What is valvular heart disease? | Circulatory System and Disease | NCLEX-RN | Khan Academy,Created by Joshua Cohen. Watch the next lesson: ...,2014-10-22T02:47:34Z,khanacademymedicine,289000,2438,40,PT10M41S,cardiovascular_diseases,TRUE
hF7qdTBFIxU,The Worst Kind of Heart Disease &amp; How to Prevent It,Be sure to check out the sponsor of today's video LetsGetChecked and use the coupon code IOHA25 to get 25% off your test!,2024-03-03T15:15:02Z,Institute of Human Anatomy,258741,12664,673,PT14M56S,cardiovascular_diseases,TRUE
CXyrVYrwV3k,The Role of Lipoprotein(a) in Cardiovascular Disease,"DrJayneMorgan from the @TheABCardio and Dr. Laurence Sperling, Family Heart Chief Medical Officer, join for ...",2025-03-06T17:20:16Z,Family Heart Foundation,431,21,4,PT14M49S,cardiovascular_diseases,TRUE
NIjDl0XV9D8,Health Equity in Cardiovascular Disease Prevention: Opportunities for Research and Practice,"""Health Equity in Cardiovascular Disease Prevention: Opportunities for Research and Practice"" Stanford Center for Clinical ...",2022-11-01T16:33:11Z,Stanford Center for Clinical Research,625,6,2,PT1H2M34S,cardiovascular_diseases,TRUE
KL4zEnWAykM,Stopping Heart Disease Progression: What Everyone Should Know,This is a clip from my recent lecture on an amazing technology called CT angiography with Fractional Flow Reserve (FFR-CT) that ...,2024-05-08T16:31:29Z,"Dr. Pradip Jamnadas, MD",374835,10040,639,PT11M33S,cardiovascular_diseases,TRUE
rUEhILmiYqA,How to tell if you have a Weak vs. Strong Heart #doctor #surgeon #hearthealth #heartsurgery #fypシ,,2024-10-22T13:48:26Z,"Jeremy London, MD",1038697,36212,701,PT57S,cardiovascular_diseases,TRUE
Gb6pI2Grec4,Cholesterol and heart disease | Heart Foundation,Did you know that having high cholesterol can increase your risk of heart attack or stroke? Learn more at ...,2022-01-12T23:12:05Z,Heart Foundation,68446,191,8,PT1M52S,cardiovascular_diseases,TRUE
N3JG3OO32Eg,Early Signs of Heart Failure #integrativemedicine,Do you know what the early signs of heart failure are? They can be subtle or mild...Here's what to look for.,2023-08-28T17:00:11Z,Montgomery Heart & Wellness,586733,18125,449,PT1M1S,cardiovascular_diseases,TRUE
bk2ikUJQeNY,Menopause can increase your risk of heart disease #shorts,"Menopause doesn't cause heart disease overnight — but it raises the risk. Dr. Andrea Vitello, cardiologist at Baptist Health Miami ...",2025-07-17T18:35:39Z,Baptist Health,288,NA,0,PT1M24S,cardiovascular_diseases,TRUE
Akg2WAyGK6A,Foods That Reverse Heart Disease | Dr. Neal Barnard Live Q&amp;A,There are foods that may help unclog arteries and possibly even reverse heart disease. Dr. Neal Barnard reveals what you can ...,2022-08-03T16:50:04Z,Physicians Committee,329072,7052,946,PT43M20S,cardiovascular_diseases,TRUE
0sZpJQDGoLo,Cardiovascular Disease and Diabetes,"Diabetics are at an increased risk for cardiovascular diseases. Diabetes Educator Kelly Jantz, CMSRN, CDCES, shares what you ...",2024-04-18T14:19:52Z,NKC Health,488,4,0,PT1M22S,cardiovascular_diseases,TRUE
hCInTIzvV9w,Reducing Cardiovascular Disease in Women,"Dr. Cerrone Foster, along with undergraduate students in the Department of Biological Sciences, studies the ways in which ...",2023-03-28T21:38:07Z,East Tennessee State University,627,11,0,PT1M,cardiovascular_diseases,TRUE
0wXWEdipBEg,How Fasting and Diet can Prevent Heart Disease Especially for High Risk Patients like South Asians,"This lecture is centered around Coronary Artery Disease in South Asians, but most of this information applies to everyone.",2022-03-21T20:13:55Z,"Dr. Pradip Jamnadas, MD",3052674,60654,3257,PT1H22M43S,cardiovascular_diseases,TRUE
I12PMiX5h3E,Animation - Coronary stent placement,"Please ""Courtesy: Mayo Clinic News Network."" Learn about coronary angioplasty and stents ...",2019-10-02T19:48:11Z,Mayo Clinic,5276670,7446,NA,PT14S,cardiovascular_diseases,TRUE
t9vXqtXzKTE,Can You Reverse Heart Disease?,"If a scan shows plaque in your arteries—can you undo the damage? Yes. But first, you need visibility. You can't fix what you don't ...",2025-07-09T19:12:18Z,Dr. Gabrielle Lyon,12461,452,3,PT46S,cardiovascular_diseases,TRUE
Gsu8NT1yYes,Congestive Heart Failure | Clinical Medicine,Premium Member Resources: www.ninjanerd.org/lecture/pathophysiology-of-congestive-heart-failure-chf Ninja Nerds! In this ...,2024-03-11T23:00:09Z,Ninja Nerd,665793,14961,362,PT58M20S,cardiovascular_diseases,TRUE
_xfhpz8yJY4,NCD Academy | HIV and Cardiovascular Disease in the Aging,HIV and Cardiovascular Disease and Aging Conditions describes the pathophysiology of aging for those living with HIV. It gives ...,2025-05-07T19:03:02Z,American College of Cardiology,85,NA,NA,PT12M18S,cardiovascular_diseases,TRUE
CMTdFcn1u6M,Signs and Symptoms of Atherosclerosis,What is Atherosclerosis and its symptoms? #Atherosclerosis #HeartHealth #Cardiology #Cardiologist #AtherosclerosisSymptoms ...,2023-09-24T20:01:39Z,Modern Heart and Vascular Institute,59330,895,6,PT51S,cardiovascular_diseases,TRUE
PHDafMDG7u8,Rheumatic aortic valve stenosis: how it affects the heart. Explained in 3D by VOKA,"The aortic valve is essential for blood circulation, ensuring oxygen-rich blood flows from the heart to the body. However, after ...",2025-03-12T11:30:46Z,VOKA 3D Anatomy & Pathology,15996711,157171,115,PT31S,cardiovascular_diseases,TRUE
bCs3iygB_60,3 heart tests that you need to know about #doctor #surgeon #heartattack #hearthealth #fyp,My Newsletter* https://www.drjeremylondon.com/ *Thank you to our sponsors* LMNT Electrolytes: https://drinklmnt.com/london ...,2024-08-07T14:53:24Z,"Jeremy London, MD",201126,7935,180,PT59S,cardiovascular_diseases,TRUE
BcDWvZxT3tU,Help Avoid Stroke and Heart Attack!  Dr. Mandell,,2022-04-05T15:13:38Z,motivationaldoc,1386440,59505,826,PT24S,cardiovascular_diseases,TRUE
Zrxiy0fIjFw,Congenital Heart Malformations Made Easy (8 Main Types),"A look at the main forms of congenital heart disease including Left to Right Shunts (VSD,ASD, Patent Ductus Arteriosus, ...",2023-10-09T11:00:34Z,Rhesus Medicine,417017,7076,103,PT19M28S,cardiovascular_diseases,TRUE
ZC3wRx4vV7g,"Prevent and Reverse Heart Disease with Caldwell B. Esselstyn, Jr., M.D.",Dr. Esselstyn is a physician and the author of Prevent and Reverse Heart Disease. He is the Director of the Cardiovascular ...,2018-12-21T13:46:26Z,Sentara Health,1024495,NA,NA,PT1H8M12S,cardiovascular_diseases,TRUE
