video_id,title,description,published_at,channel_title,view_count,like_count,comment_count,duration,topic,professional
rXqUspaO1Fk,Best Time to Take Probiotics &amp; Prebiotics,Please hit that red SUBSCRIBE button! Site-Wide Discount on all OLIPOP Flavors: https://drinkolipop.com/thomas This video does ...,2021-04-14T20:00:19Z,Thomas DeLauer,190682,5117,282,PT8M32S,probiotics,FALSE
QZa9dukjfX4,What Are Probiotics? | ప్రోబయోటిక్స్ అంటే ఏమిటి ? | Dr.ETV | 2nd December 2021 | ETV Life,What Are Probiotics #Dretv #Health #ETVWin ప్రోబయోటిక్స్ అంటే ఏమిటి ? General Physician Dr Shiva ...,2021-12-02T14:00:49Z,ETV Life India,79462,480,10,PT3M15S,probiotics,FALSE
CifZ8Yd0FPU,Not all probiotics are the same!,"There are many different strains—each with unique benefits for gut, skin, mood, and immune health. Knowing which one your ...",2025-10-21T19:08:27Z,Dr. Emily Parke,1290,31,0,PT1M29S,probiotics,FALSE
QbSbLLlbUes,Gut Health Simplified | Indian Prebiotics &amp; Probiotics You Must Try!,"Almost 50% of Indians struggle with gut issues like bloating, acidity, and constipation. But did you know your kitchen already has ...",2025-06-20T07:28:01Z,MyHealthBuddy,186052,3881,30,PT34S,probiotics,FALSE
rr8HJH4Dtk8,Top Probiotic Strains for Weight Loss,Which strains of probiotics are most helpful for weight loss? We analyze the research and break down the effectiveness of different ...,2022-08-11T13:00:36Z,"Dr. Brian Yeung, ND",54436,1113,52,PT8M23S,probiotics,FALSE
hdlmMzyBFHw,The difference between prebiotics and probiotics | Unlocking Gut Health | Optimizing Digestion,"Gut health refers to the optimal functioning and balance of the gastrointestinal tract, including the stomach, small intestine, and ...",2023-07-11T12:30:17Z,The Yoga Institute,64069,1616,47,PT3M21S,probiotics,FALSE
Oe9o0OoAiak,"The difference between probiotics, prebiotics and postbiotics","ABC News chief medical correspondent Dr. Jen Ashton talks about the difference between probiotics, prebiotics and postbiotics ...",2023-07-20T19:57:54Z,Good Morning America,37472,302,9,PT3M,probiotics,FALSE
azlJeRQU3yE,Do You Need Probiotics for ‘Down There’?,Probiotics are everywhere and now they are available for lady parts! OB/GYN Dr. Nita Landry shares that if you have a healthy ...,2020-03-14T20:00:01Z,The Doctors,145150,1170,124,PT1M44S,probiotics,FALSE
CqiwNY0omd4,Best Probiotic Foods and Supplements to Support Gut Health Naturally,Gut health has become one of the most important conversations in wellness and for good reason. Our digestive system is home to ...,2025-08-22T17:00:20Z,Medical Centric Podcast,3869,42,0,PT3M38S,probiotics,FALSE
sBSRHvpDgCU,Harvard-Trained Gut Doctor Ranks 10 Supplements for Gut Health (1–10 Scale) ⁉️🚨,,2025-06-27T03:24:44Z,Doctor Sethi ,635592,5590,100,PT20S,probiotics,FALSE
lFDpTNM_b6o,Prebiotics &amp; Probiotics,,2023-04-04T12:13:45Z,Gabay sa Kalusugan - Dr. Gary Sy,51597,1284,24,PT59S,probiotics,FALSE
2KOC3-wDNwk,💊A bacteria-battling remedy for yeast infections!💊 #obgyn #yeastinfections #probiotics #feminine,,2024-03-22T16:15:00Z,Doctor P,22150,262,10,PT8S,probiotics,FALSE
qqIAnbIL2J4,"Kefir is a probiotic that helps provide the precursor to melatonin, lowers cortisol and much more",,2023-11-09T21:16:27Z,Dr. Eric Berg DC,173169,6983,189,PT33S,probiotics,FALSE
fAkvwDiU-YM,Eat These for Your Gut Health #probiotics #prebiotics,,2023-07-03T15:08:15Z,Jefferson Health,7666,149,4,PT15S,probiotics,FALSE
q4vc-0ToXLs,How To Test Your Probiotic Supplement By Making Yogurt,"If you've ever wondered if the probiotics in your supplement are alive or not, wonder no longer! You can test them by making ...",2023-03-26T15:24:52Z,Grand Cultures,238526,8846,409,PT56S,probiotics,FALSE
QgLE8802Y38,PROBIOTICS for WEIGHT LOSS: Can Probiotics Help to Lose Weight?,Explore the best probiotic options!   ✓ Ritual Synbiotic+ ➡️ https://hlth.news/get-synbiotic/ ✓ yourbiology gut+ ...,2023-12-05T19:00:09Z,Healthnews,1545,43,1,PT8M59S,probiotics,FALSE
i5hm51ZA5xs,Probiotics For Gut Health   Warning Signs That You Need Probiotics,The Ultimate Probiotic Guide: https://nuvisionexcel.com/complete-probiotic-guide/ Probiotics For Gut Health | Warning Signs That ...,2021-05-09T12:47:35Z,Dr. Nick Zyrowski,43153,1668,338,PT10M44S,probiotics,FALSE
nvkegIx8Rps,5 Indian probiotic alternatives to Yakult | @Foodpharmer | Dr Pal,Share with anyone who will find it useful! Yakult has 38% more sugar than coke! A tiny 65ml bottle of Yakult has 2.4 teaspoons of ...,2023-10-29T15:23:03Z,Dr Pal,713124,11880,359,PT1M30S,probiotics,FALSE
G2CQlN7p1Os,DIY Probiotic Soda with Ginger Bug,"DIY probiotic sodas | Did you know you can make homemade probiotic soda with a bug? Not that kind of a bug, but a ginger bug.",2023-08-29T13:51:22Z,Crowded Kitchen,3343606,197803,1489,PT44S,probiotics,FALSE
gJ1UmNBlGp0,Neuroscientist Reveals How to Repair Gut Health without Probiotics - Dr. Sherr,Use Code THOMAS for 15% off Fatty15: http://fatty15.com/thomas For the TroCalm mentioned in this video and 10% off ...,2024-11-12T15:19:39Z,Thomas DeLauer,1230344,32013,2563,PT20M43S,probiotics,FALSE
VLadFgnFI4Y,Why Your Probiotics Might Be a Total Waste of Money | Gary Brecka,Are your supplements actually helping—or just draining your wallet? Gary Brecka exposes one of the biggest myths in the health ...,2025-04-14T21:56:21Z,Cognitive Alchemy,8545,57,9,PT25S,probiotics,FALSE
_DRzkefIq6Q,What Is Probiotics? | #shorts #probiotics,,2023-09-21T18:29:00Z,Dr Umesh Wadhavani,13592,580,16,PT1M,probiotics,FALSE
qrkwio740E0,Can Probiotics Products Truly Transform Your Gut Health? 🌱,"Discover the shocking truth about how bad bacteria secretly influence your food choices, and watch the full video to take control of ...",2023-12-07T12:41:40Z,Traya Health,262078,4913,40,PT36S,probiotics,FALSE
A9CXxaDkpdE,What are probiotics? These are the health benefits | SELF IMPROVED,Registered dietician @AbbeysKitchen explains everything you need to know about probiotics. Read more: What do probiotics do?,2024-01-18T14:42:10Z,USA TODAY,18493,168,9,PT1M30S,probiotics,FALSE
997phZGi5Bk,"Probiotic Pills: Usually Harmful, Sometimes Fatal",Dr. Sean Spencer from Stanford's Microbiome Lab: probiotic pills reduce microbiome diversity and survival rates for cancer.,2025-05-14T13:05:47Z,Viva Longevity!,137106,5945,1825,PT1H19M31S,probiotics,FALSE
2Q-GilOanVA,Elok Makan Probiotic? #malay #shorts,Subscribe right now and let us know what to cover next! (it'll be epic) Join us on Telegram for daily skincare tips: ...,2022-11-07T16:00:01Z,Dr Ingky,18533,255,10,PT35S,probiotics,FALSE
zOUZTGSHifI,Top Probiotics: Lactobacillus rhamnosus GG &amp; Digestive Advantage | Michael Bush,"We discuss Lactobacillus rhamnosus GG (Culturelle), the most studied probiotic with thousands of clinical studies. We also cover ...",2025-06-09T13:16:26Z,Modern Healthspan,2161,23,3,PT55S,probiotics,FALSE
NGKWKFGIqv8,Probiotic | Dr. Ye Yint,Probiotic နှင့်ပတ်သက်ပြီးလူတိုင်းသိထားသင့်သော အချက် (၃) ချက် #probiotics ...,2022-10-13T12:24:10Z,Dr. Ye Yint,10017,587,8,PT3M10S,probiotics,FALSE
QE6scX4Ods0,"Lacto-fermentation is so easy! All you need is salt, water, &amp; time to create probiotic-rich foods!",For the full recipe + a step-by -step free guide on how to Lacto ferment fruit: ...,2025-04-25T20:18:51Z,GoodFoodBaddie,373766,13488,263,PT46S,probiotics,FALSE
FrI3cK1-GQI,#probioticsupplements #probiotic #drnageswarreddy #probioticsfoods #sakshitvlife  #healthtipstelugu,Dr. D Nageshwar Reddy About Probiotic Supplements | Sakshi TV Life.,2023-11-02T04:30:03Z,Sakshi Life,188069,3638,24,PT56S,probiotics,FALSE
ucdxXEKqUIM,"What Are Probiotics? Benefits, Uses &amp; How They Improve Gut Health!","Heard about probiotics but not sure what they do? Probiotics are live bacteria and yeasts that support digestion, immunity, and ...",2021-12-04T05:04:39Z,Pharmacist Online,1655,36,7,PT6M35S,probiotics,FALSE
S2RB8nQT1dA,Probiotics: Hype or Helpful?   H2CT Ann Reardon,"Do probiotics really help your gut microbiome?? You can sign up to Revolut: https://get.revolut.com/z4lF/howtocookthat, use your ...",2025-06-20T09:30:06Z,How To Cook That,221194,14170,1220,PT27M38S,probiotics,FALSE
uIA59Azy8kk,Probiotics EVERY Woman Needs Daily | Improve Your GUT &amp; VAG HEALTH | The BEST Probiotic Supplements,"The best advice about probiotics for women on what types of probiotics women of all ages need to take for healthy guts, healthy ...",2019-03-12T00:08:07Z,Natural Health Resources,123396,2925,283,PT6M54S,probiotics,FALSE
F_B8KgaZn_s,Probiotics Supplement: Ano Mangyayari Kung Uminom Araw-Araw. - By Doc Willie Ong,Probiotics Supplement: Ano Mangyayari Kung Uminom Araw-Araw. By Doc Willie Ong (Internist and Cardiologist) Panoorin ang ...,2023-01-02T05:00:07Z,Doc Willie Ong,201582,3067,21,PT12M22S,probiotics,FALSE
NEKAtcOeUT8,Which Probiotics Actually Work in Ulcerative Colitis? | Dr. Pranab Gyawali Explains,"Do probiotics really help with ulcerative colitis (UC)? And if so—which ones actually work? As a gastroenterologist in Dubai, ...",2025-06-19T04:39:35Z,Dr. Pranab Gyawali,2901,48,2,PT1M50S,probiotics,FALSE
-SXoAw_r6Y4,Best Time to Take Your Probiotics ⁉️Harvard Doctor Reveals,,2025-08-23T02:45:42Z,Doctor Sethi ,107684,2792,67,PT33S,probiotics,FALSE
I1r-I0rBVJA,Taste testing the most viral probiotic yogurt 👀 Is Coconut Cult worth it?! #guthealth #probiotics,"coconut cult, probiotic yogurt, gut health, gut healing, live probiotics, taste test, wellness tiktok, functional foods, healthy gut, ...",2025-06-18T14:13:28Z,Ash | PCOS Lifestyle ,20103,990,42,PT1M,probiotics,FALSE
CrVqP_kEx9s,ถอดรหัส #Microbiome เจาะลึกจักรวาล #Probiotics ใครกินเป็นได้เปรียบ [SkinTalk Ep.16] #SkinTalk,จักรวาล Microbiome จุลชีพทั้งหมดในร่างกาย คลิปนี้มีมากกว่า Probiotics Prebiotics ที่หลายคนรู้จักกัน ดีอย่างไร ? มีผลอย่างไรต่อร่างกาย ...,2024-06-28T13:00:10Z,Skin Talk ,116442,3512,349,PT1H47S,probiotics,FALSE
TQy382fGPV4,5 Probiotics for constipation #probiotics #constipation #constipationrelief,,2024-12-27T00:24:28Z,Dr. Daniel Ricciardi,2561,69,4,PT35S,probiotics,FALSE
QmURQ6P58wo,Dr. Rajsree&#39;s Guide to Probiotics: Specific Strains That Prevent and Reverse Diseases!,"Dr. Rajsree Nambudripad, MD is board-certified in Internal Medicine and founder of OC Integrative Medicine in Orange County, ...",2024-11-30T19:39:12Z,"Rajsree Nambudripad, MD",98831,2402,170,PT44M53S,probiotics,FALSE
NlER5Z8akSI,What is the difference between probiotics and antibiotics?,"Check out Dr. Dhaval Dave Gastroenterologist, Hepatologist and Endoscopist @aadicurahospitals to share his views on this topic.",2024-12-01T07:10:27Z,Aadicura Superspecialty Hospital,1967,47,0,PT59S,probiotics,FALSE
hGF7i8n-PZ0,Did you know probiotics can make pregnancy healthier for mama and baby?,Women who took probiotics during pregnancy had: ✓ Lower risk of gestational diabetes = more likely that baby will have a ...,2025-05-22T17:13:55Z,Dr. Loredana Shapson,2168,34,0,PT35S,probiotics,FALSE
bz4n_GkdU7s,Probiotic Capsules Under Microscope (Do Dry Probiotics Work?),,2022-09-14T18:51:46Z,CloseIntel,223810,NA,166,PT1M,probiotics,FALSE
mkIwYowluEY,5 Things You Should Know About Probiotics | Dr. Janine,5 Things You Should Know About Probiotics | Dr. Janine Dr. Janine shares five things you should know about probiotics. She talks ...,2023-03-07T12:00:37Z,"Dr. Janine Bowring, ND",9530,501,28,PT2M11S,probiotics,FALSE
ZoeMHAEsps8,Probiotics : The Truth About Gut Health Supplements! Dr. Kavya Dendukuri #shorts @MedPlusONETV,"Feeling bloated or imbalanced? You're not alone! Millions reach for probiotic supplements, but are they the magic bullet for gut ...",2024-05-07T11:30:22Z,MedPlus ONE TV,18884,276,2,PT59S,probiotics,FALSE
V-I_P0QLTbM,I learned my lesson but I love probiotics now #probiotics #guthealth #selfcare #lifelessons,,2023-12-25T15:25:10Z,Xara Beqele,233741,12217,63,PT58S,probiotics,FALSE
7QPzLgiETEk,Yakult Drink Under Microscope (Probiotic),,2023-03-02T19:16:58Z,CloseIntel,4014845,200454,4072,PT1M,probiotics,FALSE
RY0C0Gx3L7M,&quot;Probiotics&quot; ที่อยู่ใกล้ตัวเเละสามารถทำเองได้,อาจารย์มาศ #เวชศาสตร์ครอบครัว #เวชศาสตร์ป้องกัน #สุขภาพดี #เคล็ดลับสุขภาพ #probiotics #lifestyle #เทรนด์วันนี้ ้.,2025-06-04T09:00:40Z,AntiAging By DrMart,13365,277,7,PT39S,probiotics,FALSE
qC9NlRk5dkE,Can CVS Pharmacy Do Probiotics? | CVS Pharmacy,"Curious if CVS Pharmacy has probiotics? Spoiler: They do, and they're amazing! From tasty gummies to refreshing kombucha, ...",2024-07-29T14:00:45Z,CVS Pharmacy,1379,13,0,PT18S,probiotics,FALSE
3UdEf2VOb2g,Should You Take Probiotics?,"Probiotic Supplements have been thought to have great benefits, here's the truth behind them. #probiotics #healthylifestyle ...",2022-09-28T22:15:01Z,Abud Bakri,64289,916,20,PT40S,probiotics,FALSE
O7nRiH3wzYM,Do probiotics and prebiotics help gut health?,"Thinking about whether you should be taking prebiotics and probiotics? As a Doctor, I'm often asked by my patients if prebiotic ...",2025-08-25T19:02:03Z,Almira Medical,519,4,1,PT1M3S,probiotics,FALSE
kr7wOW-Wtpk,#1 PROBIOTICS EXPERT: Using Microbes To OPTIMIZE Your Health | Dr. Gregor Reid,"Dr. Gregor Reid is a world-renowned microbiologist, author, and the scientist who defined “probiotics” for the UN/WHO.",2024-07-25T10:00:47Z,Rich Roll,109900,2288,208,PT1H46M52S,probiotics,FALSE
9tlI_Liu9gQ,Everyone Needs Probiotics BUT...Don&#39;t take if You Have This | Dr. Raghu D K @MedPlusONETV,Everyone Needs Probiotics BUT...Don't take if You Have This | Dr. Raghu D K  ⁨@MedPlusONETV⁩ #probioticsupplements ...,2025-05-02T14:45:02Z,MedPlus ONE TV,2034,11,0,PT49S,probiotics,FALSE
FuyfubWotXY,Probiotics VS Prebiotics | What is the Difference ? | Dt.Bhawesh | #dietitian #guthealth #shorts,,2025-05-02T06:22:45Z,DietTube India,355095,17679,195,PT1M10S,probiotics,FALSE
XaGStHUkvk4,3 Best Probiotics In India?,3 Best Probiotics In India? TO CONSULT: Call: +91 8080 850 950 ...,2023-06-26T17:27:07Z,Dr.S.R.Welling - For LifeLong Cure ,16272,158,22,PT8M15S,probiotics,FALSE
xYyQqKj1P7k,ప్రోబయోటిక్స్ వెనుక నిజాలు #probioticsupplements #drrvraghavendrarao #shorts @MedPlusONETV,"In this #Shorts video With Dr. R.V Raghavendra Rao - Gastroenterologist , we're dishing out the essential facts on using probiotics ...",2023-12-19T12:30:40Z,MedPlus ONE TV,38351,516,3,PT1M,probiotics,FALSE
15oQIf2kE7Y,What Are Probiotics &amp; Is There Any Harm In Taking Them |  Medicine Box  | N18S | CNBC TV18,The Medicine Box | What are probiotics and is there any harm in taking them? Which food products help you deal with acidity?,2024-04-07T08:37:41Z,CNBC-TV18,21115,436,2,PT59S,probiotics,FALSE
90_z89sR2ec,Ye 4 probiotic foods jarur le #shorts,Ye 4 probiotic foods jarur le #shorts 3 PROBIOTIC FOODS IN INDIAN DIET – YOU MUST KNOW AND USE.I AM A ...,2024-12-09T11:47:49Z,The Gastro Liver Hospital Kanpur,885789,29263,148,PT59S,probiotics,FALSE
l533N5Qns6Y,Top 12 High PROBIOTICS Foods,Discover the Top 12 High Probiotic Foods that naturally boost your gut health and support better digestion. Enter your name and ...,2025-05-04T00:43:11Z,My Vital Life,155027,408,2,PT9S,probiotics,FALSE
2gJw8GGdEBM,"Probiotic rich, lacto-fermented vegetables #probiotics #preservingfood #scratchcooking #guthealth",,2022-11-14T19:57:10Z,Kelsey Thomas - Functional Perinatal RD & Trainer,66170,NA,24,PT30S,probiotics,FALSE
FKCSfvQEaCE,Kombucha - the secret probiotic and fermented drink that Dr. Pal swears by for optimal gut health!,"Watch the full video ft. @PriyaPal_Vibes to learn more about Kombucha and its benefits, with a fun Q&A session. #Kombucha ...",2024-08-03T11:50:16Z,Dr Pal,5270382,177759,1662,PT1M,probiotics,FALSE
uBxP7ckbf4U,Prebiotic and probiotics Kab Lena hota hai kya fayda hota hai #shorts Dr.Education,,2022-01-29T18:55:54Z,Dr.Education FAQ,467173,NA,121,PT59S,probiotics,FALSE
r-UtgNy5i14,Do You Need Probiotics? - Part 1 | #shorts 355,Do You Need Probiotics? - Part 1 | #shorts 355 | good & bad bacteria | #short #reels #health #nutrition #food #fit #fitness #workout ...,2023-10-27T13:23:40Z,Pehle Health,57192,2575,30,PT1M,probiotics,FALSE
BXFkbTWo5NY,Mouth Probiotics - Should You Take Them to Relieve Gut Problems and Bad Breath?,1) Schedule your INITIAL APPOINTMENT (We Take Insurance!): https://www.oswalddigestiveclinic.com/scheduling 2) ...,2023-06-20T20:00:03Z,Oswald Digestive Clinic,2719,66,11,PT6M26S,probiotics,FALSE
MPsdzsLHNJg,What makes the Pendulum family of probiotics stand out?,What makes the Pendulum family of probiotics stand out from the ones you'd find at your local drugstore or big box store?,2025-05-29T18:44:31Z,Ernie Rupp,845,4,0,PT1M28S,probiotics,FALSE
nwvddsp-gcA,What are probiotics? What are the best probiotic foods? | Dr. Arunkumar,ப்ரோபயாடிக் என்றால் என்ன? | சிறந்த ப்ரோபயாடிக் உணவுகள் என்னென்ன?,2023-05-10T08:30:10Z,Doctor Arunkumar,213463,3744,195,PT9M46S,probiotics,FALSE
s1ZczL8A0Jg,The more you know ladies🫶🏼 #probiotics  #physicianschoice,,2024-02-20T21:39:41Z,Physician's Choice,2911,75,0,PT53S,probiotics,FALSE
nxHMk3LLwJQ,#1 Probiotic DRINK For Gut Health,1 Probiotic DRINK For Gut Health @AnshulGuptaMD #shorts #food #dranshulguptamd.,2025-02-22T15:01:30Z,Anshul Gupta MD ,255869,8447,187,PT58S,probiotics,FALSE
HbvJEywLx_o,Taking probiotics with antibiotics #probiotics #antibiotics #druginteractions #shorts #youtube,"Yes, it's generally recommended to take probiotics and antibiotics separately, ideally with a 2-hour gap between doses. This helps ...",2025-04-14T14:00:32Z,Dr. Afraz Ahmed Official,1171,26,2,PT1M22S,probiotics,FALSE
5dtLh5GKiVs,top 5 probiotic foods for gut health #probiotics,"top 5 probiotic foods for gut health If you're looking to improve your gut health, then check out our list of the top 5 probiotic foods ...",2023-09-27T13:20:21Z,The Stoic Summit,151473,2769,12,PT36S,probiotics,FALSE
WWC72or9lgw,Having Probiotics Every Day Has These 8 Health Benefits,"Bacteria, Yeast, microorganisms, these might not sound like the best things to be present inside your body or in your food. Heck!",2020-08-24T01:15:01Z,Bestie Health,124409,3110,75,PT7M28S,probiotics,FALSE
0Yy9K3r6hRI,Which probiotics are best for gut health,"Which probiotics are best for gut health. What probiotics do, are probiotics good, can probiotics be harmful, probiotics while on ...",2020-12-16T18:00:02Z,Rhoades24eva,2445,111,15,PT6M,probiotics,FALSE
gfcmxIIb8qY,Probiotic क्या होते है? क्या काम करते है? #probiotics #guthealth #immunity #digestivehealth #shorts,Probiotics Kya Hai? | Probiotic क्यों खाने चाहिए? Gut Health का असली हीरो | जानिए फायदे और ...,2025-05-14T05:52:03Z,HEALTH AND MEDICINES HINDI,40521,1117,19,PT2M45S,probiotics,FALSE
8nYIg3p4oLY,Why Pre- and Probiotics are Crucial for Pet Parents ? #shorts,We talk about the importance of giving pre- and probiotics to our pets. Probiotics are beneficial bacteria in the gastrointestinal tract ...,2024-10-25T11:21:36Z,Lets Talk K9 ( THE K9 STORE ),4726,161,0,PT1M1S,probiotics,FALSE
95JH5iQrUvg,Simply Probiotic Benefits,Wellness starts from the inside out. Discover how Simply Probiotic supports gut health #Herbalife #SimplyProbiotic #guthealth ...,2025-05-22T17:00:20Z,Herbalife,30775,656,17,PT24S,probiotics,FALSE
OnaAYl0DlE4,Achieve True Innard Peace with Florastor Probiotics #florastor #probiotics #guthealth,"Unlike other probiotics that add tons of bacteria to your gut, Florastor flushes out the bad and boosts your own good bacteria—so ...",2025-04-22T17:24:41Z,Florastor® Dual Action Probiotics,552665,321,0,PT16S,probiotics,FALSE
58HEpZbsNSw,Probiotics 101 in under a minute ⏱️,Here's the basics: Probiotics = good gut bacteria that help support your overall wellness‡ Prebiotics = food for those ...,2025-10-09T16:29:49Z,Physician's Choice,1759,13,1,PT47S,probiotics,FALSE
XxZ1MzXCrgA,Probiotics vs Prebiotics: Which Do You Need More for Gut Health?,"Probiotics vs Prebiotics are two terms often used interchangeably when discussing gut health, but they play distinctly different ...",2025-10-20T05:00:39Z,Medical Centric Podcast,1059,52,4,PT3M58S,probiotics,FALSE
IoZ5PtFyhww,5 Gut Friendly Foods #guthealth  #cleaneating #probiotics #prebioticos,,2024-04-13T04:44:13Z,Thomas McGee,182018,5922,98,PT49S,probiotics,FALSE
w9qZN2rag_E,Top 8 Probiotic Foods You Should Eat,FREE BOOK + DOCUMENTARY: https://heartdiseasecode.com/health/ ▻ ▻ JOIN HEART DISEASE CODE: ...,2023-03-26T12:00:42Z,Heart Disease Code,271301,8113,163,PT17M22S,probiotics,FALSE
AkOLR_Af2LY,Uncovering the Secret to Fast Weight Loss: The Power of Probiotics &amp; Supplements in the Microbiome,"Get your exclusive discount and FREE #FloraSweets chocolates now at https://revivalpoint.com/dawn In this video, Dawn ...",2023-02-11T21:30:54Z,Dawn Gallagher,4160,77,28,PT6M55S,probiotics,FALSE
zAOj786jEgY,Probiotic ကို သောက်သုံးပေးခြင်းဖြင့် ရရှိလာမဲ့ အကျိုးကျေိးဇူးတွေကဘာလဲ?,ခန္ဓာကိုယ်အတွက် Probiotic ဓာတ်တွေ ဘာလို့ လိုအပ်တာလဲ အဲ့ Probiotic ...,2024-07-06T14:30:30Z,7887 Healthcare,7223,355,19,PT4M37S,probiotics,FALSE
hje8PVF7elM,Costco Hotdog VS. Digestive Enzymes #probiotics #physicianschoice #digestiveenzymes #guthealth,,2025-01-09T18:12:37Z,Physician's Choice,27281,1999,4,PT41S,probiotics,FALSE
wsTSq_1EpaY,BioGaia UK: Protectis Baby Drops - Baby probiotics,"Our best probiotics for your baby! Trusted by parents everywhere, our multi-award-winning probiotic drops provide your baby with ...",2024-06-14T08:13:18Z,BioGaia,33357,72,4,PT10S,probiotics,FALSE
msJkPGgZ6us,Can Probiotics Provide FAST and EFFECTIVE Relief from Acid Reflux and Gerd | Hiatal Hernia Relief,Link to buy: https://www.refluxshield.com/ https://refluxsummit.com/?aff=RefluxShield ...,2025-09-22T18:15:37Z,Synergy Wellness Chiropractic & Physical Therapy PLLC,1798,36,0,PT57S,probiotics,FALSE
9sMFkM_NVfs,Gut-Brain Connection: The Power of Probiotics for Boosting Mental Clarity and Mood #brain #shorts,Andrew Huberman is a neuroscientist and professor at Stanford University who studies brain function and the effects of various ...,2023-02-25T15:00:12Z,TrueTHINK ,10716,208,3,PT44S,probiotics,FALSE
3GIP7sSmu0g,Best Probiotic Food For Gut Health by Ryan fernando #shorts,Best Probiotic Food For Gut Health by Ryan fernando #probioticfood #ryanfernando #homeremedies Utensils that I use (Amazon ...,2025-03-04T13:15:00Z,Food Link,2660389,83703,706,PT45S,probiotics,FALSE
n6ySHeVvupc,Fermented Garlic | Probiotic | Gut Friendly Garlic Pickle #recipe #probiotics #healthy #guthealth,,2025-05-25T18:05:19Z,Somewhat Chef,175519,3295,18,PT30S,probiotics,FALSE
k2VfeXiVTBk,Probiotic Lemonade,"Detailed recipe for this probiotic lemonade with full instructions, troubleshooting tips and q&a's is in my new digital fermentation ...",2025-03-11T19:11:39Z,Kirsten Kaminski,755284,26520,270,PT32S,probiotics,FALSE
k8BaE1EEhps,Top 5 Best Probiotics for Women! (Boost Gut Health &amp; Well-Being Today!),"Looking for the best probiotics for women's health? Probiotics can improve digestion, immunity, skin health, and even hormone ...",2023-10-04T15:47:40Z,Pharmacist Online,1769,11,1,PT5M24S,probiotics,FALSE
Q1KHmWfZt70,stop taking probiotics #probiotics #bloating #acidrefluxtreatment #acidreflux #reflux,,2022-09-17T18:13:41Z,Reece Mander Nutritionist,78745,314,83,PT16S,probiotics,FALSE
uNSetXKUqyY,"Confusing, but Important Concept? Prebiotics vs Probiotics","Both prebiotics and probiotics are important for human health. However, they have different roles: Probiotics. These are live ...",2022-06-10T10:30:11Z,Sleepy Classes IAS,21382,829,7,PT1M,probiotics,FALSE
nNsQ884ZTA8,The Best probiotics for women #probiotics #healthygut #guthealth,,2024-10-10T16:12:44Z,Helloediyie,46074,341,4,PT12S,probiotics,FALSE
iPotgOwJcXc,Probiotics for Detoxification,Researchers have now shown that the probiotics found in yogurt can aid in the elimination of toxins (including but probably not ...,2025-01-09T17:15:03Z,Dr. DiNezza - Gut Microbiome Queen 👑,1938,127,7,PT1M1S,probiotics,FALSE
aX0f6P-q24s,3 Ways to Ferment Vegetables at Home (for Probiotics and Gut Health),"It's easy to ferment vegetables at home, and make your own probiotic foods that will support your gut health, digestive system, and ...",2021-12-02T16:30:00Z,Happy Bellyfish,195815,5502,132,PT9M53S,probiotics,FALSE
UH3BmdFbwxc,The benefits of Probiotics,"The benefits of Probiotics Supplements for total wellness: http://bit.ly/3lOFhTq For more health tips, go to ...",2023-09-09T03:00:28Z,Dr. Nicolle MD - Maximize Health (Dr. Nicolle MD),52405,228,2,PT16S,probiotics,FALSE
uS-uvEO4tGA,A Traditional Indian Probiotic - Winter Special Kanji Drink Recipe,"A Traditional Indian Probiotic - Winter Special Kanji Drink Recipe | Naturally Fermented Healthy Kanji Drink Recipe This tangy, ...",2024-12-01T08:00:50Z,Tassa Joe ,2676722,64979,675,PT28S,probiotics,FALSE
