video_id,title,description,published_at,channel_title,view_count,like_count,comment_count,duration,topic,professional
1aPT7TrEkN0,Esse é o pior exame para DIABETES!- Dr Turí Souza,Exames de Diabetes: O Dr. Turí Souza Revela o Que Observar nos Seus Resultados Você faz exames para diabetes? O Dr. Turí ...,2025-05-26T21:00:02Z,Dr. Turí Souza - Especialista em Diabetes,41321,1425,10,PT37S,diabetes,TRUE
QsSZNetJIuA,Mayo Clinic Minute: Type 2 diabetes – What you need to know,"Type 2 diabetes is a growing health concern. According to the Centers for Disease Control and Prevention, 22 million people in ...",2016-11-14T19:45:26Z,Mayo Clinic,352508,1473,NA,PT1M,diabetes,TRUE
WIgWoeCjMSc,¿Qué es DIABETES? y como se diagnostica #DIABETES #glucosaalta #prediabetes,Qué es DIABETES? y como se diagnostica #DIABETES #glucosaalta #prediabetes.,2025-02-23T01:48:24Z,Dra. Zuraima Especialista en Diabetes,15211,1200,16,PT2M56S,diabetes,TRUE
ODF1C-i14XE,"¿Qué es la diabetes? | La conexión entre la enfermedad renal, la enfermedad cardíaca y la diabetes",Estás enfrentando una enfermedad renal? Habla con alguien que ha pasado por lo mismo. Conoce más: ...,2022-05-12T23:50:19Z,National Kidney Foundation,146400,685,13,PT2M16S,diabetes,TRUE
bb15r5fooX8,Tanda AWAL Tubuhmu Kebanyakan GULA. Waspada penyakit Gula Diabetes. #diabetes #doktersaraf #neuro,"Halo Sobat DoktersarafKU, Selamat datang di Channel Youtube saya, dr Fajar Rudy Qimindra Sp.N CIPS FIPP , Dokter Saraf ...",2024-08-14T19:31:12Z,DokterSarafKu,4163548,51128,580,PT1M,diabetes,TRUE
IjdVMuEtZeY,You DON’T need medication or supplements to reverse insulin resistance (diabetes),Do you need to take medication or supplements to reverse insulin resistance? Or can it be done naturally?,2025-02-13T18:45:00Z,Kait Malthaner (BSc Nutrition & Exercise),483515,13831,512,PT40S,diabetes,TRUE
n67Anrpljo4,Top 7 Diabetes Triggers You MUST AVOID (How to Reverse Diabetes),"Did you know that 1 in 3 Americans have prediabetes? In this eye-opening episode of the Dr. Josh Axe Show, we dive deep into ...",2024-07-30T16:00:54Z,Dr. Josh Axe,207769,8204,479,PT33M59S,diabetes,TRUE
8usXnjKwFqk,replace my DEXCOM with me 🤠 #t1d #typeonediabetes #diabetes #dexcom #dexcomg7,,2024-10-08T20:15:40Z,Mary Comeau,1056761,NA,273,PT1M1S,diabetes,TRUE
N4H7OoM9p60,Diabetes: tudo o que você precisa saber sobre a condição,"O diabetes é caracterizado pela não produção ou resistência à insulina, e atinge mais de 16 milhões de brasileiros adultos.",2024-11-11T22:00:27Z,Drauzio Varella,68293,4173,86,PT9M19S,diabetes,TRUE
Lbn82jaZLHE,Diabetes Medications,"An overview of the classes, mechanisms, indications, and side effects of diabetes medications, including metformin, SGLT2 ...",2020-08-17T09:00:10Z,Strong Medicine,283680,3237,82,PT18M40S,diabetes,TRUE
XFItmO30jOg,Ya sabes que es la DIABETES GESTACIONAL ? #diabetes #embarazo #diabetesgestacional,"Hablamos sobre la diabetes gestacional, que ocurre únicamente en mujeres embarazadas y se diagnostica entre las semanas ...",2025-02-21T22:31:47Z,Dra. Zuraima Especialista en Diabetes,20599,467,7,PT34S,diabetes,TRUE
k1F_K-OX9Oc,Insulin Pump Site Change with ExpressionMed Tapes #expressionmed #insulinpump #tslim #diabetes #t1d,"Add some color to your pump site with ExpressionMed tapes! With over 300 designs to choose from, you're sure to find something ...",2023-06-16T09:00:37Z,ExpressionMed,4092710,176820,592,PT42S,diabetes,TRUE
wyYrGfRK3xU,Type 1 vs Type 2 #diabetes,,2025-03-02T10:01:05Z,Dr Matt & Dr Mike,9224,320,2,PT52S,diabetes,TRUE
hMMWfCM1vvw,"Diabetes, Síntomas Diabetes","www.clinicadelcampestre.com presenta diabetes, síntomas diabetes. La diabetes mellitus es una enfermedad producida por un ...",2014-05-15T18:50:47Z,Clínica del Campestre,2886198,28647,1302,PT14M11S,diabetes,TRUE
eQLTkvCtQR8,Quem tem diabetes não pode comer pão: Fato ou mito? #dicasdesaude #diabetes #insulina,,2025-04-29T21:19:24Z,Dra. Monalisa Azevedo,230439,9931,555,PT1M52S,diabetes,TRUE
ePylP2XmNRs,Diabetes Exercises At Home Workout: To Help Control Diabetes (Level 1),Diabetes Exercises At Home Workout: To Help Cure Diabetes (Level 1) // Caroline Jordan // Diabetes exercises are an important ...,2019-09-02T15:00:14Z,Caroline Jordan,5400571,94154,4964,PT14M33S,diabetes,TRUE
lj3zx5jSbiE,Simple exercise for DIABETIC PATIENT! #diabetes #diabetic #diabeticcare,,2024-09-13T13:16:17Z,Physical Therapy Session,854623,10790,72,PT12S,diabetes,TRUE
KqzaKro5Bt0,Vitamin D and diabetes,"Vitamin D and Risk for Type 2 Diabetes in People With Prediabetes, (7th Feb 2023) ...",2023-02-07T10:55:48Z,Dr. John Campbell,2172175,59752,5913,PT15M18S,diabetes,TRUE
QFCky7cMywE,Reverse Type 2 Diabetes #diabetes #remission #reversal #health #doctor #weightloss,,2023-12-12T13:02:56Z,Diabetes.co.uk,4993,95,0,PT46S,diabetes,TRUE
We31MhxVaeU,Fatty Liver Can Lead to Diabetes #shorts #diabetes,"In this video, Dr Sarin shares the relationship between fatty liver and diabetes. Discover how fatty liver can potentially lead to the ...",2024-06-28T15:30:17Z,Be Healthy Be Strong,8897537,NA,34,PT53S,diabetes,TRUE
izln1qInAkA,SYMPTOMS OF TYPE ONE DIABETES 🧃💉 #t1d #diabetes #typeonediabetes #omnipod #insulin #youtubeshorts,,2024-07-19T23:58:39Z,Mary Comeau,547042,NA,909,PT1M1S,diabetes,TRUE
gs5h987ccRw,O que é DIABETES? | Diabetes Explicada #1,O que é Diabetes? O que causa Diabetes? Como a Diabetes Começa? Quais as consequências do diabetes e como o diabético ...,2024-04-16T20:00:12Z,"Olá, Ciência!",239640,24842,518,PT11M22S,diabetes,TRUE
w4pqjpaOefE,DIABETES: wat is dat precies?,Meer video's? Abonneer je op ons kanaal! https://www.youtube.com/nos Mensen met diabetes type 2 kunnen voor een groot deel ...,2018-03-09T10:27:29Z,NOS,107407,373,17,PT1M36S,diabetes,TRUE
mhI7xOVEoOo,5 SINTOMAS DE DIABETES que você precisa SABER,Sintomas de Diabetes que você precisa saber.,2024-07-24T14:00:42Z,"Olá, Ciência!",301194,22639,151,PT50S,diabetes,TRUE
fwdkQTXEx1s,"Diabetes | Parte 1 | Definição, tipos e fisiopatologia",Nesta aula vamos conversar sobre a fisiopatologia do Diabetes. Espero que gostem! Referências: - www.diabetes.org.br ...,2020-10-29T17:30:10Z,Anatomia e etc. com Natalia Reinecke,493808,26746,471,PT11M27S,diabetes,TRUE
Tvqdov6TL-U,3 Cara Makan yang Bisa Bikin Kita Bebas Diabetes,sb30health #nasi #diabetes #berasmentah #remix #shorts.,2023-10-14T10:17:29Z,SB30Health,1044847,14504,122,PT55S,diabetes,TRUE
liff4GlU6Kw,I RAN OUT OF INSULIN 💉 #t1d #type1diabetes #typeonediabetes #diabetes #omnipod #youtubeshorts,,2025-06-28T19:55:10Z,Mary Comeau,570344,NA,162,PT59S,diabetes,TRUE
KNfsAWjjfWQ,Borderline diabetes? How to prevent getting Type 2 Diabetes - a doctor explains.,Being told you have 'borderline diabetes' or 'pre-diabetes' can be worrying—but it's also an opportunity to make changes and ...,2021-03-25T22:20:32Z,Dr Sophie GP,268950,3854,752,PT9M3S,diabetes,TRUE
iTGrExsZi-c,Does eating sugar cause DIABETES? 🩸👩🏻‍⚕️ #doctortalks #podcastclips #healthpodcast #diabetes,,2024-06-10T13:44:35Z,BeatO,78805,1381,21,PT45S,diabetes,TRUE
UJZyHmwWj9k,INSULINA e DIABETES Tipo 1 e 2 | Biologia com Samuel Cunha,Aula sobre INSULINA e DIABETES tipo 1 e 2 | Biologia com Samuel Cunha ESTUDE NA MINHA PLATAFORMA: ...,2023-05-10T18:00:22Z,Biologia com Samuel Cunha,111631,6955,113,PT16M48S,diabetes,TRUE
IJV1HeuiwWg,16 Diabetes Foods To Eat Often To Help Reverse Diabetes!,Head to Sugarmds.com to join our newsletter! Discover exclusive secrets on reversing diabetes and unique care methods you ...,2022-06-15T23:33:26Z,SugarMD,3895283,63684,2050,PT20M14S,diabetes,TRUE
yNXcZYSJiTc,Ozempic for Diabetes: What you NEED TO KNOW!,Ozempic is a new once a week injection to treat type 2 diabetes. It's probably one of the more common advertised medications ...,2022-11-28T16:38:59Z,Erik Richardson D.O.,67507,815,97,PT4M48S,diabetes,TRUE
t2Z9NBjLOf0,Correcting a HIGH BLOOD SUGAR 😤💉 #t1d #type1diabetes #typeonediabetes #diabetes #youtubeshorts,,2025-07-03T23:58:23Z,Mary Comeau,246015,NA,95,PT38S,diabetes,TRUE
1NIhv6fCqAU,I Cured My Type 2 Diabetes | This Morning,GP Dr Michael Mosley was diagnosed with Type 2 diabetes four years ago and rather than start on medication - he invented the ...,2016-09-23T14:16:37Z,This Morning,2224732,16208,236,PT4M49S,diabetes,TRUE
akVF0_5_eK0,Easy No-Sugar Diabetic Meal Plan #shorts,"Keep your blood sugar in check throughout the week with this easy meal plan for breakfast, lunch, and dinner! #EatingWell ...",2023-08-19T13:00:04Z,EatingWell,77041,1422,15,PT17S,diabetes,TRUE
14sTJNrUA2c,What Diabetes Does to the Body | Can You Reverse It?,Go to https://athleticgreens.com/humananatomy to get started on your first purchase and receive a FREE 1-year supply of Vitamin ...,2022-09-23T14:05:00Z,Institute of Human Anatomy,809587,29289,2161,PT17M27S,diabetes,TRUE
dFchPwpGC8U,Why THIS could lead to diabetes 😳,Yes it's reversible! #diabetes #exercise #health #prediabetes #healthcare #med #medicine #medical #suture #meded #learn ...,2025-03-18T23:30:10Z,Doctor Myro,19779426,685097,9531,PT1M8S,diabetes,TRUE
gzugmzOgMKU,change my dexcom with me! #typeonediabetes #diabetes #t1d #dexcom #youtubeshorts,,2022-11-05T19:06:38Z,Mary Comeau,49486569,NA,5860,PT54S,diabetes,TRUE
tNVnk8bfz_M,Can potatoes be taken by people with Diabetes? | Dr. V Mohan,"Potatoes are a versatile and delicious vegetable that can be enjoyed by everyone, including people with diabetes. However ...",2021-12-07T10:34:20Z,Dr V Mohan,60628,1152,18,PT30S,diabetes,TRUE
aHNnG4UkOnk,¿Cuáles son los primeros síntomas de diabetes?👩🏻‍⚕️ #salud #diabetes #medicina #síntomas #shorts,Video completo⬇️    ‍⚕️ https://www.youtube.com/live/Cwm5fc2KXjs?si=p1_aqrBY7W2mQ7XE.,2024-05-22T00:03:37Z,Dra. Pau Zúñiga,60712,1695,32,PT1M,diabetes,TRUE
aZZTgE5jiOY,LA DIABETES CAUSA ESTO EN TU SALUD SEXUAL,LA DIABETES PUEDE CAUSAR ESTO EN TU SALUD S3XUAL 1️⃣ Problemas de 3r3cción 2️⃣ Nivel bajo de testosterona ...,2025-08-18T16:04:10Z,Tengo un amigo que...,9941,312,1,PT47S,diabetes,TRUE
UMxHLHoOUko,Diabetes Gone with This Simple Trick! #glucose #nutrition #t2d,,2024-03-16T21:30:44Z,Glucose Revolution,1665035,58602,1068,PT46S,diabetes,TRUE
g5309fGqjCU,ended up getting a few weeks off of school 😅 #diabetes #typeonediabetes #t1d #youtubeshorts,,2022-11-11T19:22:36Z,Mary Comeau,25804011,NA,15357,PT49S,diabetes,TRUE
9NDaCgY8DPE,Do Type 1 Diabetic Zombies crave pancreases over brains? #diabetes #t1d #type1diabetes #dexcom,,2024-10-09T15:00:35Z,Clinton Svatos,23325141,553253,883,PT17S,diabetes,TRUE
6X6eFOIqufQ,12 preguntas sobre la DIABETES,Hay muchos mitos alrededor de la diabetes: una condición que afecta a millones de personas en el mundo. En esta ocasión te ...,2018-08-19T15:14:46Z,CuriosaMente,651651,26534,851,PT9M7S,diabetes,TRUE
Zjet2h8Zw44,Debunking common myths about diabetes | Ohio State Medical Center,"Does insulin cause weight gain? Is type 1 the ""bad"" kind of diabetes? The Ohio State University Wexner Medical Center Diabetes ...",2023-11-07T14:40:59Z,Ohio State Wexner Medical Center,8061,109,0,PT15S,diabetes,TRUE
fazeCkUgkwQ,Diabetes tipo 1,"Este si te gusta la animación, igual que nosotros en Facebook: http://www.nucleusinc.com/facebook Esta animación en 3D ...",2012-07-06T20:48:51Z,Nucleus Medical Media,1055497,13580,700,PT5M55S,diabetes,TRUE
lpRDhUKGI1I,Know the Signs of Type 1 Diabetes! #expressionmed #type1diabetes #dexcomg6 #healthtracker #diabetic,Do you know the signs of Type 1 Diabetes?,2022-09-04T14:30:18Z,ExpressionMed,72336,917,57,PT10S,diabetes,TRUE
tytu6Qzu6XQ,Living with Diabetes Shopping Guide,"In this video, we'll cover foods to limit with diabetes, foods to eat more of, diabetes tips for the grocery store, and tips for eating out ...",2024-08-26T18:28:49Z,Healthline,14788,244,13,PT6M58S,diabetes,TRUE
3OcHyDFmMkc,Diabetes Treatment » Insulin » Oral Hypoglycemic Agents (Metformin),The Complete Nursing School Bundle: https://nurseinthemaking.co/nursingschoolbundle NurseInTheMaking Website: ...,2024-03-28T20:13:43Z,NurseInTheMaking,53803,1224,28,PT4M9S,diabetes,TRUE
8SaUg18EBak,Diferencia entre diabetes tipo 1 y tipo 2👩🏻‍⚕️ #diabetes #insulina #glucosa #medicina #sabíasque,Video completo⬇️    ‍⚕️ https://www.youtube.com/live/Cwm5fc2KXjs?si=Fx1NhtrhfODmw3tF.,2024-05-18T23:00:08Z,Dra. Pau Zúñiga,57677,1237,16,PT58S,diabetes,TRUE
egmchjtG_2Y,Diabetes Exercises At Home Workout: To Help Control Diabetes (Level 3),Diabetes Exercises At Home Workout: To Help Control Diabetes (Level 3) // Caroline Jordan // Diabetes exercises are an ...,2020-01-20T14:00:17Z,Caroline Jordan,765821,8591,457,PT14M10S,diabetes,TRUE
4LttAS3HpA0,Diabetes hypos | What does hypoglycaemia Feel Like? | Diabetes UK,The full name for a 'hypo' is hypoglycaemia. It happens when your blood glucose levels (otherwise known as blood sugar levels) ...,2020-05-05T14:05:58Z,Diabetes UK,167375,1576,210,PT1M16S,diabetes,TRUE
OqctHlnxuRE,Salamat Dok: Causes and types of diabetes,"Dr. Roberto Mirasol lists the causes of diabetes, and details how rice converts into sugar. He also differentiates the two types of ...",2018-10-21T07:19:30Z,ABS-CBN News,403532,3233,179,PT6M45S,diabetes,TRUE
rh8ycjPCj18,Diabetes Mellitus | Clinical Medicine,Exclusive USMLE Step 2/PANCE Lecture… for FREE! Become a member on our website for more Premium Resources: ...,2024-03-11T23:00:27Z,Ninja Nerd,613380,11626,343,PT44M57S,diabetes,TRUE
FwU-uw_a9qY,Contagious Diabetes,Stand-up comedy tickets: https://stevenhocomedy.com/ Share your hospital stories: https://www.reddit.com/r/RealHospitalStories/ ...,2025-09-20T20:00:10Z,steveioe,9245315,471653,3261,PT1M23S,diabetes,TRUE
ADTJkKEmLCc,Type 1 vs. Type 2 Diabetes Mellitus,Type 1 vs. Type 2 Diabetes Mellitus The Complete Nursing School Bundle: ...,2025-09-07T15:05:30Z,NurseInTheMaking,19369,1222,14,PT1M52S,diabetes,TRUE
UM0p91m_WEk,5 Healthy Desserts If You Have Type 2 Diabetes #diabetesreversal  #reversediabetes #type2diabetes,I'm a diabetes dietitian and these are some of my favorite desserts to eat and recommend! 1️⃣ Chocolate chia pudding ...,2023-09-12T17:29:10Z,Type 2 Diabetes Revolution,56607,614,32,PT24S,diabetes,TRUE
2TIgWmjCFno,DIABETES TIPO 2: O QUE É? CAUSAS? O QUE OCORRE?,O Diabetes tipo 2 é uma doença crônica que afeta a forma como o corpo processa o açúcar do sangue (glicose). Uma das ...,2022-04-07T14:00:02Z,DOUTOR AJUDA,84371,3874,117,PT5M18S,diabetes,TRUE
2i1oxcktdMA,SIMPLE EXERCISE FOR DIABETIC PATIENTS! #diabetes #diabetesawareness #diabetic #diabetesmanagement,,2024-06-03T12:34:00Z,Physical Therapy Session,1093825,11535,103,PT9S,diabetes,TRUE
JPdRlAM21ig,Diabetes WARNING Signs in Feet / Legs  #type2diabetes  #diabetessigns #prediabetes,"If you get odd sensations in your legs, this could be a sign of diabetic neuropathy or nerve damage caused by high sugar levels ...",2025-02-03T17:20:31Z,Doctor Khalid,400732,4237,85,PT40S,diabetes,TRUE
L2iCCZa9ttc,DIABETES TIPO 1: A Diabetes Auto-Imune | Diabetes Explicada #2,O que é Diabetes Tipo 1? Como a Diabetes Tipo 1 começa? Quais são os primeiros sintomas de diabetes tipo 1? A diabetes é ...,2024-04-23T20:00:09Z,"Olá, Ciência!",93849,10242,271,PT11M14S,diabetes,TRUE
bDnPvG33pXY,"Cuidado, estos son los primeros 3 síntomas de la diabetes",Tu cuerpo podría estar enviándote señales de alerta y no lo sabes #Diabetes #SíntomasDiabetes #Salud #Prevención ...,2025-06-12T02:45:04Z,Laura Torres - Primeros Auxilios,2709528,69607,336,PT2M30S,diabetes,TRUE
yFBf1qlmm3Y,NEW DIABETES KNOWLEDGE!!,PETER ATTIA – BRILLIANT BUT MISGUIDED and WRONG ABOUT INSULIN RESISTANCE. Dr Cywes give a PROFESSORIAL ...,2025-05-06T00:00:13Z,Dr. Robert Cywes M.D. Ph.D. #CarbAddictionDoc,57842,3822,548,PT30M30S,diabetes,TRUE
3zVZTyinz_8,DIABÉTICO PODE COMER CUSCUZ?,Descubra seu TIPO METABÓLICO e Reverta o Diabetes com o Dr. Turí Souza! Transforme sua saúde com nosso aplicativo e ...,2025-08-31T21:00:03Z,Dr. Turí Souza - Especialista em Diabetes,742947,6732,285,PT17S,diabetes,TRUE
DMoh8_qGK30,How diabetes destroys the human body,Understand what diabetes is and how this common disease often causes significant damage to the human body. License medical ...,2022-08-12T21:18:49Z,Understand,1287789,21987,963,PT6M9S,diabetes,TRUE
SK6xyb5NlLQ,La DIABETES DAÑA tus NERVIOS | ARDOR y HORMIGUEO en los PIES #neuropatia #diabetes #salud,,2024-11-22T21:13:38Z,Dr. Cristian Moya,160579,1480,26,PT51S,diabetes,TRUE
_f97dPx2vjI,Hi9 | Normal blood sugar level? | Diabetes Sugar levels | Dr.Rakesh sahay | Endocrinologist,"sugarlevels #healthtips #diabetes #bloodlevels #endocrine #hi9webtv #hi9 #podcast Diabetes is a common problem today, we ...",2017-11-06T13:25:22Z,Hi9 Web TV,2492158,12555,475,PT1M57S,diabetes,TRUE
EAKd7o9MBlc,"Diabetes in Aging: Signs, Symptoms &amp; What to Do","Diabetes is one of the most common chronic conditions in older adults, but managing it in aging requires a different approach.",2025-09-06T18:00:20Z,Better Health While Aging,16686,675,57,PT38M19S,diabetes,TRUE
6UdYRdDGT3U,Landmark discovery to &#39;dramatically reduce&#39; insulin amount for Type 1 diabetes | 9 News Australia,"In a world first clinical trial, Australian researchers have discovered a way to ""dramatically reduce"" the amount of insulin needed ...",2025-11-25T07:35:00Z,9 News Australia,2402,41,0,PT2M6S,diabetes,TRUE
4lQ50BiJIu8,Lower Your Blood Sugar Overnight 🌙,"Are you struggling with high blood sugar at night? Here's an easy three-step plan to help: Start with an early, low-carb dinner and ...",2024-12-02T15:00:05Z,SugarMD,1439459,34681,194,PT56S,diabetes,TRUE
VQ79SmBmQfU,Type 1 Diabetes Facts #expressionmed #10DaysforT1D #diabetes #insulinpump #t1d #t1diabetes,"You might not know this, but T1Ds don't have a needle in their skin 24/7! #diabeducated #diabeteseducation #10DaysForT1D ...",2022-11-20T13:00:29Z,ExpressionMed,57529,2204,86,PT38S,diabetes,TRUE
o2v-Ge97W6Y,Os remédios que abaixam a glicose não são todos iguais! #diabetes,"Neste vídeo, discutiremos alguns dos diferentes tipos de medicamentos para diabetes. É importante saber que todos tem seus ...",2023-07-09T00:04:28Z,Dr Marquezine - Escola do Diabetes,40041,2207,54,PT56S,diabetes,TRUE
DvNzAvh5Ddo,5 SAYURAN YANG DILARANG UNTUK PENDERITA DIABETES,"Penderita diabetes harus memerhatikan asupan makanan termasuk sayuran. Meski sehat, ada beberapa sayuran yang dilarang ...",2023-03-02T03:50:09Z,medcom id,468983,3723,186,PT44S,diabetes,TRUE
MIilrgEBnR8,How to Stop Pre-diabetes,How to Stop Pre-diabetes from Turning into Diabetes! #prediabetes #diabetes #exercise #healthydiet #looseweight #weightloss ...,2022-09-29T12:51:57Z,Dwain Woode MD,3592,158,1,PT1M1S,diabetes,TRUE
5ovc827i3QQ,PRE DIABETES The Silent Killer You Need to Know About,Are you at risk of Pre-Diabetes? See this video to understand what actually causes artery blockages: ...,2024-12-30T13:00:09Z,Dr Sumit Kapadia Vascular Surgeon,197413,3445,72,PT53S,diabetes,TRUE
HV9h-qlBqsE,Vídeo didáctico: La diabetes - www.pulevasalud.tv,VER TODOS LOS VÍDEOS DIDÁCTICOS EN: http://goo.gl/AX9R9 La diabetes es una enfermedad que se caracteriza por una ...,2012-04-23T11:55:15Z,PS admin,569890,3651,117,PT2M24S,diabetes,TRUE
EsKBiSlIRbk,Low blood sugar! 🧃 #diabetesawareness #typeonediabetes #diabetes #lowbloodsugar #diabetic #shorts,,2022-08-01T17:57:40Z,Mary Comeau,4717599,NA,2533,PT1M,diabetes,TRUE
l3xxCR3LGaI,Por qué la DIABETES es más COMPLEJA de lo que crees (y hoy vas a ENTENDERLA),La DIABETES MELLITUS es una enfermedad en la que las células pierden la capacidad de captar y utilizar la glucosa como ...,2021-04-04T16:00:31Z,La Hiperactina,2045562,129373,3127,PT14M4S,diabetes,TRUE
6T0qn__GPSE,Pessoas com diabetes podem comer polenta? #endocrinologia #diabetes #polenta,"A polenta é feita a base de farinha de milho e é rica em carboidratos, logo, se consumida em grande quantidade, pode aumentar ...",2025-08-09T22:23:39Z,Dr. Mateus - Endocrinologista,7905,249,2,PT1M26S,diabetes,TRUE
JhO6-rqZQag,9 SINAIS de DIABETES que acontecem à NOITE | PRIMEIROS SINTOMAS DE DIABETES e PRÉ-DIABETES (cuidado),9 SINAIS estranhos de DIABETES que acontecem à NOITE | PRIMEIROS SINTOMAS DE DIABETES e PRÉ-DIABETES ...,2024-04-09T01:30:07Z,Cardio DF — Cardiologia e saúde cardiovascular em Brasília (DF),1674787,76608,1662,PT11M12S,diabetes,TRUE
2Jxhe_whR4o,La diabetes no es exactamente como crees... #diabetes #glucosa,,2025-09-08T15:44:57Z,Centro Médico Pontevedra,2239,34,1,PT1M,diabetes,TRUE
YLunB_3wy4k,dexcom change at work 😁 #diabetes #t1d #youtubeshorts #dexcom,,2022-11-06T17:56:17Z,Mary Comeau,3160889,NA,887,PT45S,diabetes,TRUE
qZD3nW-YeYE,3 foods to eat daily if you have type 2 diabetes #insulinresistance #type2diabetes #prediabetes,,2024-04-16T01:44:18Z,Type 2 Diabetes Revolution,125202,4484,309,PT59S,diabetes,TRUE
-uK8a80vyeI,10 Best Diabetes Exercises to Lower Blood Sugar Exercise - Diabetes Workout,10 Best Diabetes Exercises to Lower Blood Sugar Exercise - Diabetes Workout Diabetes workout: 10 exercises to Lower Blood ...,2020-02-24T14:00:00Z,Caroline Jordan,3095980,43089,1927,PT12M26S,diabetes,TRUE
ntD9NEYkA3c,Diabetes BEFORE Pregnancy #diabetes #pregnancy,,2025-06-15T05:00:48Z,Alirod MD,11594,383,13,PT29S,diabetes,TRUE
ercbFjVG2Vs,5 MANEIRAS DE REVERTER O PRÉ-DIABETES!,MANEIRAS DE REVERTER O PRÉ-DIABETES! Como reverter o pré-diabetes sem remédio? É possível reverter o pré-diabetes?,2022-11-30T21:00:14Z,Dr. Roberto Yano,1228704,101626,2321,PT12M48S,diabetes,TRUE
AHL31_AxQMI,Best Drinks For Diabetics: डायबिटीज मरीज ज़रूर पिएं ये Drinks,Best Drinks For Diabetics: डायबिटीज मरीज ज़रूर पिएं ये Drinks #tv9 #trends9 #drinks #diabetes ...,2023-05-25T12:26:36Z,TV9 Bharatvarsh,2519505,64319,221,PT56S,diabetes,TRUE
rYMwZyOI5SY,Why Medications Alone Won&#39;t Solve Diabetes,"The future of diabetes, as we see it, is not tethered to the chains of medication. The recent confession by the head of the FDA at ...",2024-12-17T15:01:02Z,SugarMD,6699,383,7,PT1M10S,diabetes,TRUE
rYMwZyOI5SY,Why Medications Alone Won&#39;t Solve Diabetes,"The future of diabetes, as we see it, is not tethered to the chains of medication. The recent confession by the head of the FDA at ...",2024-12-17T15:01:02Z,SugarMD,6699,383,7,PT1M10S,diabetes,TRUE
rYMwZyOI5SY,Why Medications Alone Won&#39;t Solve Diabetes,"The future of diabetes, as we see it, is not tethered to the chains of medication. The recent confession by the head of the FDA at ...",2024-12-17T15:01:02Z,SugarMD,6699,383,7,PT1M10S,diabetes,TRUE
rYMwZyOI5SY,Why Medications Alone Won&#39;t Solve Diabetes,"The future of diabetes, as we see it, is not tethered to the chains of medication. The recent confession by the head of the FDA at ...",2024-12-17T15:01:02Z,SugarMD,6699,383,7,PT1M10S,diabetes,TRUE
CTzi50HyQtc,The Earliest SIGN of Type 2 Diabetes,"Most people think the first signs of type 2 diabetes are frequent urination, constant thirst, or sudden weight changes. But here's the ...",2025-10-10T10:00:31Z,Dr. Eric Berg DC,764657,17792,295,PT41S,diabetes,TRUE
hpUgyQyHjp4,डायबिटीज़ के मरीज़ खा सकते हैं चावल? #diabetes #diabetesawareness #shorts #reels #viral #trending,For Latest news visit | https://www.tv9hindi.com/ Subscribe to TV9 Bharatvarsh https://goo.gl/udchcy Follow TV9 Bharatvarsh on ...,2023-06-07T15:29:45Z,TV9 Bharatvarsh,297909,4096,15,PT1M,diabetes,TRUE
qX3E71DcC20,Signs I Had Diabetes #diabetes #diabetic,Here are the 5 signs I had before my type 1 diabetes diagnosis. Follow me here for more: Instagram: ...,2023-04-19T15:18:30Z,Diabetech,20046,276,18,PT17S,diabetes,TRUE
BbrP56caRyU,Diabetes Tipo 2,"Si deseas ver más imágenes médicas en 3D con precisión científica, suscríbase a nuestro canal: ...",2020-09-28T16:00:07Z,Nucleus Health Videos - Español,548092,12221,215,PT8M44S,diabetes,TRUE
rH24ay4cA3U,8 Ways to Lower Your Blood Sugar Quickly!  Dr. Mandell,,2024-05-19T21:36:16Z,motivationaldoc,260581,16495,172,PT53S,diabetes,TRUE
xEkoAv2W6iQ,Diabetes Drugs (Oral Antihyperglycemics &amp; Insulins),SUPPORT/JOIN THE CHANNEL: https://www.youtube.com/channel/UCZaDAUF7UEcRXIFvGZu3O9Q/join My goal is to reduce ...,2020-12-25T12:00:09Z,Dirty Medicine,1790542,34645,649,PT32M28S,diabetes,TRUE
6jUM3gKoNeQ,O que é exatamente DIABETES?,"Antes de entender o que é DIABETES, primeiro precisamos falar sobre AÇÚCAR. Para ser usado pelo nosso corpo, ...",2023-11-01T20:00:02Z,Manual do Mundo,617173,96179,570,PT59S,diabetes,TRUE
9nfMfRH83ic,PREDIABETES o DIABETES TIPO 2: Lo que NADIE te explica! 🔥,Descubre las diferencias entre prediabetes y diabetes tipo 2 - SOMOS ESPECIALISTAS EN DIABETES! Recibe más consejos ...,2025-04-20T15:05:37Z,Diabesmart,34054,1552,94,PT8M15S,diabetes,TRUE
JUXZ883gfXY,Cómo bajar la glucosa rápidamente #drcota #sugarcare #diabetes,Curso Glucosa Bajo Control. https://academia.sugar-care.com.mx/offers/uwFFZAB8/checkout Únete a nuestra comunidad Sugar ...,2024-09-15T01:00:10Z,Sugar Care TV,3021686,94874,1093,PT56S,diabetes,TRUE
Rv58xmMMx5M,Sintomas do início do diabetes | Coluna #146,"Estamos vivendo uma epidemia silenciosa de diabetes. E, até mesmo por falta de informação, temos a tendência de achá-la uma ...",2021-01-04T21:00:06Z,Drauzio Varella,375335,12798,252,PT1M33S,diabetes,TRUE
Xe2FgOjW4fc,10 melhores Alimentos para controlar o seu diabetes.,10 melhores Alimentos para controlar o seu diabetes Você é diabético e não consome esses alimentos? Controle o seu diabetes ...,2022-08-03T21:00:13Z,Dr. Roberto Yano,1518796,175501,4068,PT11M15S,diabetes,TRUE
